timestamp	run_id	param_changed	metric_before	metric_after	delta	status	dsr	top5_mda	params_json	parent_run_id
2026-04-09T19:10:47.677802+00:00	ab354536-exp56	strategy: triple_barrier -> quality_momentum	1.1705	-0.5942	-1.7646	discard	0.0000		{"market": "US", "start_date": "2018-01-01", "end_date": "2025-12-31", "train_window_months": 12, "test_window_months": 3, "embargo_days": 5, "holding_days": 90, "mr_holding_days": 15, "tp_pct": 10.0, "sl_pct": 12.923403579416114, "frac_diff_d": 0.4, "starting_capital": 100000.0, "max_positions": 20, "top_n_candidates": 50, "strategy": "quality_momentum", "n_estimators": 200, "max_depth": 4, "min_samples_leaf": 20, "learning_rate": 0.1, "target_annual_vol": 0, "trailing_trigger_pct": 5.0, "trailing_distance_pct": 3.0, "trailing_stop_enabled": false}	ab354536
2026-04-09T19:31:46.501706+00:00	ab354536-exp57	target_vol: ? -> 0.21882397095390363	1.1705	0.7129	-0.4576	discard	0.3394		{"market": "US", "start_date": "2018-01-01", "end_date": "2025-12-31", "train_window_months": 12, "test_window_months": 3, "embargo_days": 5, "holding_days": 90, "mr_holding_days": 15, "tp_pct": 10.0, "sl_pct": 12.923403579416114, "frac_diff_d": 0.4, "starting_capital": 100000.0, "max_positions": 20, "top_n_candidates": 50, "strategy": "triple_barrier", "n_estimators": 200, "max_depth": 4, "min_samples_leaf": 20, "learning_rate": 0.1, "target_annual_vol": 0, "trailing_trigger_pct": 5.0, "trailing_distance_pct": 3.0, "trailing_stop_enabled": false, "target_vol": 0.21882397095390363}	ab354536
2026-04-09T19:52:40.514841+00:00	ab354536-exp58	learning_rate: 0.1 -> 0.11304687892720358	1.1705	0.6580	-0.5125	discard	0.0816		{"market": "US", "start_date": "2018-01-01", "end_date": "2025-12-31", "train_window_months": 12, "test_window_months": 3, "embargo_days": 5, "holding_days": 90, "mr_holding_days": 15, "tp_pct": 10.0, "sl_pct": 12.923403579416114, "frac_diff_d": 0.4, "starting_capital": 100000.0, "max_positions": 20, "top_n_candidates": 50, "strategy": "triple_barrier", "n_estimators": 200, "max_depth": 4, "min_samples_leaf": 20, "learning_rate": 0.11304687892720358, "target_annual_vol": 0, "trailing_trigger_pct": 5.0, "trailing_distance_pct": 3.0, "trailing_stop_enabled": false}	ab354536
2026-04-09T20:13:35.152901+00:00	ab354536-exp59	mr_weight: ? -> 0.6314899486686897	1.1705	0.7129	-0.4576	discard	0.3143		{"market": "US", "start_date": "2018-01-01", "end_date": "2025-12-31", "train_window_months": 12, "test_window_months": 3, "embargo_days": 5, "holding_days": 90, "mr_holding_days": 15, "tp_pct": 10.0, "sl_pct": 12.923403579416114, "frac_diff_d": 0.4, "starting_capital": 100000.0, "max_positions": 20, "top_n_candidates": 50, "strategy": "triple_barrier", "n_estimators": 200, "max_depth": 4, "min_samples_leaf": 20, "learning_rate": 0.1, "target_annual_vol": 0, "trailing_trigger_pct": 5.0, "trailing_distance_pct": 3.0, "trailing_stop_enabled": false, "mr_weight": 0.6314899486686897}	ab354536
2026-04-09T20:34:23.455456+00:00	ab354536-exp60	mr_weight: ? -> 0.5304249969081831	1.1705	0.7129	-0.4576	discard	0.3025		{"market": "US", "start_date": "2018-01-01", "end_date": "2025-12-31", "train_window_months": 12, "test_window_months": 3, "embargo_days": 5, "holding_days": 90, "mr_holding_days": 15, "tp_pct": 10.0, "sl_pct": 12.923403579416114, "frac_diff_d": 0.4, "starting_capital": 100000.0, "max_positions": 20, "top_n_candidates": 50, "strategy": "triple_barrier", "n_estimators": 200, "max_depth": 4, "min_samples_leaf": 20, "learning_rate": 0.1, "target_annual_vol": 0, "trailing_trigger_pct": 5.0, "trailing_distance_pct": 3.0, "trailing_stop_enabled": false, "mr_weight": 0.5304249969081831}	ab354536
2026-04-09T20:55:19.493460+00:00	ab354536-exp61	trailing_trigger_pct: 5.0 -> 4.772305370139599	1.1705	0.7129	-0.4576	discard	0.2910		{"market": "US", "start_date": "2018-01-01", "end_date": "2025-12-31", "train_window_months": 12, "test_window_months": 3, "embargo_days": 5, "holding_days": 90, "mr_holding_days": 15, "tp_pct": 10.0, "sl_pct": 12.923403579416114, "frac_diff_d": 0.4, "starting_capital": 100000.0, "max_positions": 20, "top_n_candidates": 50, "strategy": "triple_barrier", "n_estimators": 200, "max_depth": 4, "min_samples_leaf": 20, "learning_rate": 0.1, "target_annual_vol": 0, "trailing_trigger_pct": 4.772305370139599, "trailing_distance_pct": 3.0, "trailing_stop_enabled": false}	ab354536
2026-04-09T21:16:08.410115+00:00	ab354536-exp62	rsi_weight: ? -> 0.6147039196943405	1.1705	0.7129	-0.4576	discard	0.2799		{"market": "US", "start_date": "2018-01-01", "end_date": "2025-12-31", "train_window_months": 12, "test_window_months": 3, "embargo_days": 5, "holding_days": 90, "mr_holding_days": 15, "tp_pct": 10.0, "sl_pct": 12.923403579416114, "frac_diff_d": 0.4, "starting_capital": 100000.0, "max_positions": 20, "top_n_candidates": 50, "strategy": "triple_barrier", "n_estimators": 200, "max_depth": 4, "min_samples_leaf": 20, "learning_rate": 0.1, "target_annual_vol": 0, "trailing_trigger_pct": 5.0, "trailing_distance_pct": 3.0, "trailing_stop_enabled": false, "rsi_weight": 0.6147039196943405}	ab354536
2026-04-09T21:36:57.962233+00:00	ab354536-exp63	volatility_weight: ? -> 0.49506989320110395	1.1705	0.7129	-0.4576	discard	0.2692		{"market": "US", "start_date": "2018-01-01", "end_date": "2025-12-31", "train_window_months": 12, "test_window_months": 3, "embargo_days": 5, "holding_days": 90, "mr_holding_days": 15, "tp_pct": 10.0, "sl_pct": 12.923403579416114, "frac_diff_d": 0.4, "starting_capital": 100000.0, "max_positions": 20, "top_n_candidates": 50, "strategy": "triple_barrier", "n_estimators": 200, "max_depth": 4, "min_samples_leaf": 20, "learning_rate": 0.1, "target_annual_vol": 0, "trailing_trigger_pct": 5.0, "trailing_distance_pct": 3.0, "trailing_stop_enabled": false, "volatility_weight": 0.49506989320110395}	ab354536
2026-04-09T21:58:11.988937+00:00	ab354536-exp64	holding_days: 90 -> 88	1.1705	0.6881	-0.4823	discard	0.1196		{"market": "US", "start_date": "2018-01-01", "end_date": "2025-12-31", "train_window_months": 12, "test_window_months": 3, "embargo_days": 5, "holding_days": 88, "mr_holding_days": 15, "tp_pct": 10.0, "sl_pct": 12.923403579416114, "frac_diff_d": 0.4, "starting_capital": 100000.0, "max_positions": 20, "top_n_candidates": 50, "strategy": "triple_barrier", "n_estimators": 200, "max_depth": 4, "min_samples_leaf": 20, "learning_rate": 0.1, "target_annual_vol": 0, "trailing_trigger_pct": 5.0, "trailing_distance_pct": 3.0, "trailing_stop_enabled": false}	ab354536
2026-04-09T22:09:01.184858+00:00	ab354536-exp65	qm_weight: ? -> 0.509108938532508	1.1705	0.6829	-0.4876	discard	0.0063		{"market": "US", "start_date": "2018-01-01", "end_date": "2025-12-31", "train_window_months": 12, "test_window_months": 3, "embargo_days": 5, "holding_days": 90, "mr_holding_days": 15, "tp_pct": 10.0, "sl_pct": 12.923403579416114, "frac_diff_d": 0.4, "starting_capital": 100000.0, "max_positions": 20, "top_n_candidates": 50, "strategy": "triple_barrier", "n_estimators": 200, "max_depth": 4, "min_samples_leaf": 20, "learning_rate": 0.1, "target_annual_vol": 0, "trailing_trigger_pct": 5.0, "trailing_distance_pct": 3.0, "trailing_stop_enabled": false, "qm_weight": 0.509108938532508}	ab354536

20260416T052900Z	seed_42	seed: 42	0.0000	0.5867	+0.0000	seed_test	1.0000			seed_stability
20260416T054936Z	seed_123	seed: 123	0.0000	0.5756	+0.0000	seed_test	1.0000			seed_stability
20260416T061015Z	seed_456	seed: 456	0.0000	0.5861	+0.0000	seed_test	1.0000			seed_stability
20260416T063054Z	seed_789	seed: 789	0.0000	0.6044	+0.0000	seed_test	1.0000			seed_stability
20260416T065128Z	seed_2026	seed: 2026	0.0000	0.5917	+0.0000	seed_test	1.0000			seed_stability
2026-04-20T17:31:30.991176+00:00	0083971f	warm-start	0.0000	1.1705	+0.0000	BASELINE	0.9526		{"market": "US", "start_date": "2018-01-01", "end_date": "2025-12-31", "train_window_months": 12, "test_window_months": 3, "embargo_days": 5, "holding_days": 90, "mr_holding_days": 15, "tp_pct": 10.0, "sl_pct": 12.923403579416114, "frac_diff_d": 0.4, "starting_capital": 100000.0, "max_positions": 20, "top_n_candidates": 50, "strategy": "triple_barrier", "n_estimators": 200, "max_depth": 4, "min_samples_leaf": 20, "learning_rate": 0.1, "target_annual_vol": 0, "trailing_trigger_pct": 5.0, "trailing_distance_pct": 3.0, "trailing_stop_enabled": false}	
2026-04-20T17:49:08.368346+00:00	0083971f-exp01	strategy: triple_barrier -> factor_model	1.1705	-1.2129	-2.3833	discard	0.0000		{"market": "US", "start_date": "2018-01-01", "end_date": "2025-12-31", "train_window_months": 12, "test_window_months": 3, "embargo_days": 5, "holding_days": 90, "mr_holding_days": 15, "tp_pct": 10.0, "sl_pct": 12.923403579416114, "frac_diff_d": 0.4, "starting_capital": 100000.0, "max_positions": 20, "top_n_candidates": 50, "strategy": "factor_model", "n_estimators": 200, "max_depth": 4, "min_samples_leaf": 20, "learning_rate": 0.1, "target_annual_vol": 0, "trailing_trigger_pct": 5.0, "trailing_distance_pct": 3.0, "trailing_stop_enabled": false}	0083971f
2026-04-20T18:10:50.167738+00:00	0083971f-exp02	fm_weight: ? -> 0.444334091941334	1.1705	0.5851	-0.5853	discard	1.0000		{"market": "US", "start_date": "2018-01-01", "end_date": "2025-12-31", "train_window_months": 12, "test_window_months": 3, "embargo_days": 5, "holding_days": 90, "mr_holding_days": 15, "tp_pct": 10.0, "sl_pct": 12.923403579416114, "frac_diff_d": 0.4, "starting_capital": 100000.0, "max_positions": 20, "top_n_candidates": 50, "strategy": "triple_barrier", "n_estimators": 200, "max_depth": 4, "min_samples_leaf": 20, "learning_rate": 0.1, "target_annual_vol": 0, "trailing_trigger_pct": 5.0, "trailing_distance_pct": 3.0, "trailing_stop_enabled": false, "fm_weight": 0.444334091941334}	0083971f
2026-04-20T18:32:16.768205+00:00	0083971f-exp03	mr_weight: ? -> 0.5037387442665453	1.1705	0.5851	-0.5853	discard	1.0000		{"market": "US", "start_date": "2018-01-01", "end_date": "2025-12-31", "train_window_months": 12, "test_window_months": 3, "embargo_days": 5, "holding_days": 90, "mr_holding_days": 15, "tp_pct": 10.0, "sl_pct": 12.923403579416114, "frac_diff_d": 0.4, "starting_capital": 100000.0, "max_positions": 20, "top_n_candidates": 50, "strategy": "triple_barrier", "n_estimators": 200, "max_depth": 4, "min_samples_leaf": 20, "learning_rate": 0.1, "target_annual_vol": 0, "trailing_trigger_pct": 5.0, "trailing_distance_pct": 3.0, "trailing_stop_enabled": false, "mr_weight": 0.5037387442665453}	0083971f
2026-04-20T18:53:41.881621+00:00	0083971f-exp04	learning_rate: 0.1 -> 0.10854448963931738	1.1705	0.5670	-0.6034	discard	1.0000		{"market": "US", "start_date": "2018-01-01", "end_date": "2025-12-31", "train_window_months": 12, "test_window_months": 3, "embargo_days": 5, "holding_days": 90, "mr_holding_days": 15, "tp_pct": 10.0, "sl_pct": 12.923403579416114, "frac_diff_d": 0.4, "starting_capital": 100000.0, "max_positions": 20, "top_n_candidates": 50, "strategy": "triple_barrier", "n_estimators": 200, "max_depth": 4, "min_samples_leaf": 20, "learning_rate": 0.10854448963931738, "target_annual_vol": 0, "trailing_trigger_pct": 5.0, "trailing_distance_pct": 3.0, "trailing_stop_enabled": false}	0083971f
2026-04-20T19:14:43.159382+00:00	0083971f-exp05	tb_weight: ? -> 0.5354249045824357	1.1705	0.5851	-0.5853	discard	0.9994		{"market": "US", "start_date": "2018-01-01", "end_date": "2025-12-31", "train_window_months": 12, "test_window_months": 3, "embargo_days": 5, "holding_days": 90, "mr_holding_days": 15, "tp_pct": 10.0, "sl_pct": 12.923403579416114, "frac_diff_d": 0.4, "starting_capital": 100000.0, "max_positions": 20, "top_n_candidates": 50, "strategy": "triple_barrier", "n_estimators": 200, "max_depth": 4, "min_samples_leaf": 20, "learning_rate": 0.1, "target_annual_vol": 0, "trailing_trigger_pct": 5.0, "trailing_distance_pct": 3.0, "trailing_stop_enabled": false, "tb_weight": 0.5354249045824357}	0083971f
2026-04-20T19:35:36.320748+00:00	0083971f-exp06	frac_diff_d: 0.4 -> 0.3885955568626218	1.1705	0.5927	-0.5778	discard	0.9985		{"market": "US", "start_date": "2018-01-01", "end_date": "2025-12-31", "train_window_months": 12, "test_window_months": 3, "embargo_days": 5, "holding_days": 90, "mr_holding_days": 15, "tp_pct": 10.0, "sl_pct": 12.923403579416114, "frac_diff_d": 0.3885955568626218, "starting_capital": 100000.0, "max_positions": 20, "top_n_candidates": 50, "strategy": "triple_barrier", "n_estimators": 200, "max_depth": 4, "min_samples_leaf": 20, "learning_rate": 0.1, "target_annual_vol": 0, "trailing_trigger_pct": 5.0, "trailing_distance_pct": 3.0, "trailing_stop_enabled": false}	0083971f
2026-04-20T19:56:41.289803+00:00	0083971f-exp07	holding_days: 90 -> 105	1.1705	0.5622	-0.6083	discard	0.9999		{"market": "US", "start_date": "2018-01-01", "end_date": "2025-12-31", "train_window_months": 12, "test_window_months": 3, "embargo_days": 5, "holding_days": 105, "mr_holding_days": 15, "tp_pct": 10.0, "sl_pct": 12.923403579416114, "frac_diff_d": 0.4, "starting_capital": 100000.0, "max_positions": 20, "top_n_candidates": 50, "strategy": "triple_barrier", "n_estimators": 200, "max_depth": 4, "min_samples_leaf": 20, "learning_rate": 0.1, "target_annual_vol": 0, "trailing_trigger_pct": 5.0, "trailing_distance_pct": 3.0, "trailing_stop_enabled": false}	0083971f
2026-04-20T20:17:39.287092+00:00	0083971f-exp08	frac_diff_d: 0.4 -> 0.4798427537565127	1.1705	0.5238	-0.6466	discard	0.9682		{"market": "US", "start_date": "2018-01-01", "end_date": "2025-12-31", "train_window_months": 12, "test_window_months": 3, "embargo_days": 5, "holding_days": 90, "mr_holding_days": 15, "tp_pct": 10.0, "sl_pct": 12.923403579416114, "frac_diff_d": 0.4798427537565127, "starting_capital": 100000.0, "max_positions": 20, "top_n_candidates": 50, "strategy": "triple_barrier", "n_estimators": 200, "max_depth": 4, "min_samples_leaf": 20, "learning_rate": 0.1, "target_annual_vol": 0, "trailing_trigger_pct": 5.0, "trailing_distance_pct": 3.0, "trailing_stop_enabled": false}	0083971f
2026-04-20T20:39:24.410742+00:00	0083971f-exp09	n_estimators: 200 -> 202	1.1705	0.5601	-0.6103	discard	0.8118		{"market": "US", "start_date": "2018-01-01", "end_date": "2025-12-31", "train_window_months": 12, "test_window_months": 3, "embargo_days": 5, "holding_days": 90, "mr_holding_days": 15, "tp_pct": 10.0, "sl_pct": 12.923403579416114, "frac_diff_d": 0.4, "starting_capital": 100000.0, "max_positions": 20, "top_n_candidates": 50, "strategy": "triple_barrier", "n_estimators": 202, "max_depth": 4, "min_samples_leaf": 20, "learning_rate": 0.1, "target_annual_vol": 0, "trailing_trigger_pct": 5.0, "trailing_distance_pct": 3.0, "trailing_stop_enabled": false}	0083971f
2026-04-20T21:01:58.068010+00:00	0083971f-exp10	n_estimators: 200 -> 238	1.1705	0.5791	-0.5913	discard	0.8128		{"market": "US", "start_date": "2018-01-01", "end_date": "2025-12-31", "train_window_months": 12, "test_window_months": 3, "embargo_days": 5, "holding_days": 90, "mr_holding_days": 15, "tp_pct": 10.0, "sl_pct": 12.923403579416114, "frac_diff_d": 0.4, "starting_capital": 100000.0, "max_positions": 20, "top_n_candidates": 50, "strategy": "triple_barrier", "n_estimators": 238, "max_depth": 4, "min_samples_leaf": 20, "learning_rate": 0.1, "target_annual_vol": 0, "trailing_trigger_pct": 5.0, "trailing_distance_pct": 3.0, "trailing_stop_enabled": false}	0083971f
2026-04-20T21:23:06.058516+00:00	0083971f-exp11	max_positions: 20 -> 19	1.1705	0.5911	-0.5793	discard	0.9291		{"market": "US", "start_date": "2018-01-01", "end_date": "2025-12-31", "train_window_months": 12, "test_window_months": 3, "embargo_days": 5, "holding_days": 90, "mr_holding_days": 15, "tp_pct": 10.0, "sl_pct": 12.923403579416114, "frac_diff_d": 0.4, "starting_capital": 100000.0, "max_positions": 19, "top_n_candidates": 50, "strategy": "triple_barrier", "n_estimators": 200, "max_depth": 4, "min_samples_leaf": 20, "learning_rate": 0.1, "target_annual_vol": 0, "trailing_trigger_pct": 5.0, "trailing_distance_pct": 3.0, "trailing_stop_enabled": false}	0083971f
2026-04-20T21:44:04.966080+00:00	0083971f-exp12	trailing_stop_enabled: False -> True	1.1705	0.5851	-0.5853	discard	0.7486		{"market": "US", "start_date": "2018-01-01", "end_date": "2025-12-31", "train_window_months": 12, "test_window_months": 3, "embargo_days": 5, "holding_days": 90, "mr_holding_days": 15, "tp_pct": 10.0, "sl_pct": 12.923403579416114, "frac_diff_d": 0.4, "starting_capital": 100000.0, "max_positions": 20, "top_n_candidates": 50, "strategy": "triple_barrier", "n_estimators": 200, "max_depth": 4, "min_samples_leaf": 20, "learning_rate": 0.1, "target_annual_vol": 0, "trailing_trigger_pct": 5.0, "trailing_distance_pct": 3.0, "trailing_stop_enabled": true}	0083971f
2026-04-20T22:04:56.712134+00:00	0083971f-exp13	target_vol: ? -> 0.18726349446022078	1.1705	0.6714	-0.4990	discard	0.9752		{"market": "US", "start_date": "2018-01-01", "end_date": "2025-12-31", "train_window_months": 12, "test_window_months": 3, "embargo_days": 5, "holding_days": 90, "mr_holding_days": 15, "tp_pct": 10.0, "sl_pct": 12.923403579416114, "frac_diff_d": 0.4, "starting_capital": 100000.0, "max_positions": 20, "top_n_candidates": 50, "strategy": "triple_barrier", "n_estimators": 200, "max_depth": 4, "min_samples_leaf": 20, "learning_rate": 0.1, "target_annual_vol": 0, "trailing_trigger_pct": 5.0, "trailing_distance_pct": 3.0, "trailing_stop_enabled": false, "target_vol": 0.18726349446022078}	0083971f
2026-04-20T22:25:43.937253+00:00	0083971f-exp14	tp_pct: 10.0 -> 9.592219734706257	1.1705	0.7476	-0.4229	discard	1.0000		{"market": "US", "start_date": "2018-01-01", "end_date": "2025-12-31", "train_window_months": 12, "test_window_months": 3, "embargo_days": 5, "holding_days": 90, "mr_holding_days": 15, "tp_pct": 9.592219734706257, "sl_pct": 12.923403579416114, "frac_diff_d": 0.4, "starting_capital": 100000.0, "max_positions": 20, "top_n_candidates": 50, "strategy": "triple_barrier", "n_estimators": 200, "max_depth": 4, "min_samples_leaf": 20, "learning_rate": 0.1, "target_annual_vol": 0, "trailing_trigger_pct": 5.0, "trailing_distance_pct": 3.0, "trailing_stop_enabled": false}	0083971f
2026-04-20T22:46:27.894936+00:00	0083971f-exp15	target_annual_vol: 0 -> 0.05	1.1705	0.6714	-0.4990	discard	0.9448		{"market": "US", "start_date": "2018-01-01", "end_date": "2025-12-31", "train_window_months": 12, "test_window_months": 3, "embargo_days": 5, "holding_days": 90, "mr_holding_days": 15, "tp_pct": 10.0, "sl_pct": 12.923403579416114, "frac_diff_d": 0.4, "starting_capital": 100000.0, "max_positions": 20, "top_n_candidates": 50, "strategy": "triple_barrier", "n_estimators": 200, "max_depth": 4, "min_samples_leaf": 20, "learning_rate": 0.1, "target_annual_vol": 0.05, "trailing_trigger_pct": 5.0, "trailing_distance_pct": 3.0, "trailing_stop_enabled": false}	0083971f
2026-04-20T23:05:23.133550+00:00	0083971f-exp16	top_n_candidates: 50 -> 45	1.1705	0.7233	-0.4472	discard	1.0000		{"market": "US", "start_date": "2018-01-01", "end_date": "2025-12-31", "train_window_months": 12, "test_window_months": 3, "embargo_days": 5, "holding_days": 90, "mr_holding_days": 15, "tp_pct": 10.0, "sl_pct": 12.923403579416114, "frac_diff_d": 0.4, "starting_capital": 100000.0, "max_positions": 20, "top_n_candidates": 45, "strategy": "triple_barrier", "n_estimators": 200, "max_depth": 4, "min_samples_leaf": 20, "learning_rate": 0.1, "target_annual_vol": 0, "trailing_trigger_pct": 5.0, "trailing_distance_pct": 3.0, "trailing_stop_enabled": false}	0083971f
2026-04-20T23:26:11.352315+00:00	0083971f-exp17	min_samples_leaf: 20 -> 24	1.1705	0.5954	-0.5751	discard	0.9795		{"market": "US", "start_date": "2018-01-01", "end_date": "2025-12-31", "train_window_months": 12, "test_window_months": 3, "embargo_days": 5, "holding_days": 90, "mr_holding_days": 15, "tp_pct": 10.0, "sl_pct": 12.923403579416114, "frac_diff_d": 0.4, "starting_capital": 100000.0, "max_positions": 20, "top_n_candidates": 50, "strategy": "triple_barrier", "n_estimators": 200, "max_depth": 4, "min_samples_leaf": 24, "learning_rate": 0.1, "target_annual_vol": 0, "trailing_trigger_pct": 5.0, "trailing_distance_pct": 3.0, "trailing_stop_enabled": false}	0083971f
2026-04-20T23:46:55.670257+00:00	0083971f-exp18	trailing_stop_enabled: False -> True	1.1705	0.6714	-0.4990	discard	0.8726		{"market": "US", "start_date": "2018-01-01", "end_date": "2025-12-31", "train_window_months": 12, "test_window_months": 3, "embargo_days": 5, "holding_days": 90, "mr_holding_days": 15, "tp_pct": 10.0, "sl_pct": 12.923403579416114, "frac_diff_d": 0.4, "starting_capital": 100000.0, "max_positions": 20, "top_n_candidates": 50, "strategy": "triple_barrier", "n_estimators": 200, "max_depth": 4, "min_samples_leaf": 20, "learning_rate": 0.1, "target_annual_vol": 0, "trailing_trigger_pct": 5.0, "trailing_distance_pct": 3.0, "trailing_stop_enabled": true}	0083971f
2026-04-21T00:07:38.134940+00:00	0083971f-exp19	target_vol: ? -> 0.21794626614685556	1.1705	0.7200	-0.4505	discard	0.9635		{"market": "US", "start_date": "2018-01-01", "end_date": "2025-12-31", "train_window_months": 12, "test_window_months": 3, "embargo_days": 5, "holding_days": 90, "mr_holding_days": 15, "tp_pct": 10.0, "sl_pct": 12.923403579416114, "frac_diff_d": 0.4, "starting_capital": 100000.0, "max_positions": 20, "top_n_candidates": 50, "strategy": "triple_barrier", "n_estimators": 200, "max_depth": 4, "min_samples_leaf": 20, "learning_rate": 0.1, "target_annual_vol": 0, "trailing_trigger_pct": 5.0, "trailing_distance_pct": 3.0, "trailing_stop_enabled": false, "target_vol": 0.21794626614685556}	0083971f
