timestamp	run_id	param_changed	metric_before	metric_after	delta	status	dsr	top5_mda	params_json	parent_run_id
2026-04-08T18:07:24.226243+00:00	f230a984-exp06	sma_weight: ? -> 0.5847076647812804	1.1705	0.6098	-0.5606	discard	1.0000		{"market": "US", "start_date": "2018-01-01", "end_date": "2025-12-31", "train_window_months": 12, "test_window_months": 3, "embargo_days": 5, "holding_days": 90, "mr_holding_days": 15, "tp_pct": 10.0, "sl_pct": 12.923403579416114, "frac_diff_d": 0.4, "starting_capital": 100000.0, "max_positions": 20, "top_n_candidates": 50, "strategy": "triple_barrier", "n_estimators": 200, "max_depth": 4, "min_samples_leaf": 20, "learning_rate": 0.1, "target_annual_vol": 0, "trailing_trigger_pct": 5.0, "trailing_distance_pct": 3.0, "trailing_stop_enabled": false, "sma_weight": 0.5847076647812804}	f230a984
2026-04-08T18:30:04.349525+00:00	f230a984-exp07	tb_weight: ? -> 0.6117176407849003	1.1705	0.6098	-0.5606	discard	0.9999		{"market": "US", "start_date": "2018-01-01", "end_date": "2025-12-31", "train_window_months": 12, "test_window_months": 3, "embargo_days": 5, "holding_days": 90, "mr_holding_days": 15, "tp_pct": 10.0, "sl_pct": 12.923403579416114, "frac_diff_d": 0.4, "starting_capital": 100000.0, "max_positions": 20, "top_n_candidates": 50, "strategy": "triple_barrier", "n_estimators": 200, "max_depth": 4, "min_samples_leaf": 20, "learning_rate": 0.1, "target_annual_vol": 0, "trailing_trigger_pct": 5.0, "trailing_distance_pct": 3.0, "trailing_stop_enabled": false, "tb_weight": 0.6117176407849003}	f230a984
2026-04-08T18:52:47.561700+00:00	f230a984-exp08	sl_pct: 12.923403579416114 -> 13.477098811727345	1.1705	0.5932	-0.5772	discard	1.0000		{"market": "US", "start_date": "2018-01-01", "end_date": "2025-12-31", "train_window_months": 12, "test_window_months": 3, "embargo_days": 5, "holding_days": 90, "mr_holding_days": 15, "tp_pct": 10.0, "sl_pct": 13.477098811727345, "frac_diff_d": 0.4, "starting_capital": 100000.0, "max_positions": 20, "top_n_candidates": 50, "strategy": "triple_barrier", "n_estimators": 200, "max_depth": 4, "min_samples_leaf": 20, "learning_rate": 0.1, "target_annual_vol": 0, "trailing_trigger_pct": 5.0, "trailing_distance_pct": 3.0, "trailing_stop_enabled": false}	f230a984
2026-04-08T19:15:15.636412+00:00	f230a984-exp09	momentum_weight: ? -> 0.5328624147922298	1.1705	0.6098	-0.5606	discard	0.9985		{"market": "US", "start_date": "2018-01-01", "end_date": "2025-12-31", "train_window_months": 12, "test_window_months": 3, "embargo_days": 5, "holding_days": 90, "mr_holding_days": 15, "tp_pct": 10.0, "sl_pct": 12.923403579416114, "frac_diff_d": 0.4, "starting_capital": 100000.0, "max_positions": 20, "top_n_candidates": 50, "strategy": "triple_barrier", "n_estimators": 200, "max_depth": 4, "min_samples_leaf": 20, "learning_rate": 0.1, "target_annual_vol": 0, "trailing_trigger_pct": 5.0, "trailing_distance_pct": 3.0, "trailing_stop_enabled": false, "momentum_weight": 0.5328624147922298}	f230a984
2026-04-08T19:37:20.802113+00:00	f230a984-exp10	fm_weight: ? -> 0.48466484974809365	1.1705	0.6098	-0.5606	discard	0.9966		{"market": "US", "start_date": "2018-01-01", "end_date": "2025-12-31", "train_window_months": 12, "test_window_months": 3, "embargo_days": 5, "holding_days": 90, "mr_holding_days": 15, "tp_pct": 10.0, "sl_pct": 12.923403579416114, "frac_diff_d": 0.4, "starting_capital": 100000.0, "max_positions": 20, "top_n_candidates": 50, "strategy": "triple_barrier", "n_estimators": 200, "max_depth": 4, "min_samples_leaf": 20, "learning_rate": 0.1, "target_annual_vol": 0, "trailing_trigger_pct": 5.0, "trailing_distance_pct": 3.0, "trailing_stop_enabled": false, "fm_weight": 0.48466484974809365}	f230a984
2026-04-08T23:07:50.992500+00:00	ab354536	warm-start	0.0000	1.1705	+0.0000	BASELINE	0.9526		{"market": "US", "start_date": "2018-01-01", "end_date": "2025-12-31", "train_window_months": 12, "test_window_months": 3, "embargo_days": 5, "holding_days": 90, "mr_holding_days": 15, "tp_pct": 10.0, "sl_pct": 12.923403579416114, "frac_diff_d": 0.4, "starting_capital": 100000.0, "max_positions": 20, "top_n_candidates": 50, "strategy": "triple_barrier", "n_estimators": 200, "max_depth": 4, "min_samples_leaf": 20, "learning_rate": 0.1, "target_annual_vol": 0, "trailing_trigger_pct": 5.0, "trailing_distance_pct": 3.0, "trailing_stop_enabled": false}	
2026-04-08T23:29:02.220361+00:00	ab354536-exp01	volatility_weight: ? -> 0.4457547535309012	1.1705	0.6098	-0.5606	discard	1.0000		{"market": "US", "start_date": "2018-01-01", "end_date": "2025-12-31", "train_window_months": 12, "test_window_months": 3, "embargo_days": 5, "holding_days": 90, "mr_holding_days": 15, "tp_pct": 10.0, "sl_pct": 12.923403579416114, "frac_diff_d": 0.4, "starting_capital": 100000.0, "max_positions": 20, "top_n_candidates": 50, "strategy": "triple_barrier", "n_estimators": 200, "max_depth": 4, "min_samples_leaf": 20, "learning_rate": 0.1, "target_annual_vol": 0, "trailing_trigger_pct": 5.0, "trailing_distance_pct": 3.0, "trailing_stop_enabled": false, "volatility_weight": 0.4457547535309012}	ab354536
2026-04-08T23:50:11.449909+00:00	ab354536-exp02	volatility_weight: ? -> 0.4624856737224192	1.1705	0.5903	-0.5802	discard	1.0000		{"market": "US", "start_date": "2018-01-01", "end_date": "2025-12-31", "train_window_months": 12, "test_window_months": 3, "embargo_days": 5, "holding_days": 90, "mr_holding_days": 15, "tp_pct": 10.0, "sl_pct": 12.923403579416114, "frac_diff_d": 0.4, "starting_capital": 100000.0, "max_positions": 20, "top_n_candidates": 50, "strategy": "triple_barrier", "n_estimators": 200, "max_depth": 4, "min_samples_leaf": 20, "learning_rate": 0.1, "target_annual_vol": 0, "trailing_trigger_pct": 5.0, "trailing_distance_pct": 3.0, "trailing_stop_enabled": false, "volatility_weight": 0.4624856737224192}	ab354536
2026-04-09T00:11:11.046400+00:00	ab354536-exp03	tb_weight: ? -> 0.48274299996505865	1.1705	0.5903	-0.5802	discard	1.0000		{"market": "US", "start_date": "2018-01-01", "end_date": "2025-12-31", "train_window_months": 12, "test_window_months": 3, "embargo_days": 5, "holding_days": 90, "mr_holding_days": 15, "tp_pct": 10.0, "sl_pct": 12.923403579416114, "frac_diff_d": 0.4, "starting_capital": 100000.0, "max_positions": 20, "top_n_candidates": 50, "strategy": "triple_barrier", "n_estimators": 200, "max_depth": 4, "min_samples_leaf": 20, "learning_rate": 0.1, "target_annual_vol": 0, "trailing_trigger_pct": 5.0, "trailing_distance_pct": 3.0, "trailing_stop_enabled": false, "tb_weight": 0.48274299996505865}	ab354536
2026-04-09T00:32:14.901989+00:00	ab354536-exp04	frac_diff_d: 0.4 -> 0.4306519211024756	1.1705	0.6013	-0.5691	discard	1.0000		{"market": "US", "start_date": "2018-01-01", "end_date": "2025-12-31", "train_window_months": 12, "test_window_months": 3, "embargo_days": 5, "holding_days": 90, "mr_holding_days": 15, "tp_pct": 10.0, "sl_pct": 12.923403579416114, "frac_diff_d": 0.4306519211024756, "starting_capital": 100000.0, "max_positions": 20, "top_n_candidates": 50, "strategy": "triple_barrier", "n_estimators": 200, "max_depth": 4, "min_samples_leaf": 20, "learning_rate": 0.1, "target_annual_vol": 0, "trailing_trigger_pct": 5.0, "trailing_distance_pct": 3.0, "trailing_stop_enabled": false}	ab354536
2026-04-09T00:53:21.376705+00:00	ab354536-exp05	trailing_trigger_pct: 5.0 -> 4.586124333738947	1.1705	0.5903	-0.5802	discard	0.9994		{"market": "US", "start_date": "2018-01-01", "end_date": "2025-12-31", "train_window_months": 12, "test_window_months": 3, "embargo_days": 5, "holding_days": 90, "mr_holding_days": 15, "tp_pct": 10.0, "sl_pct": 12.923403579416114, "frac_diff_d": 0.4, "starting_capital": 100000.0, "max_positions": 20, "top_n_candidates": 50, "strategy": "triple_barrier", "n_estimators": 200, "max_depth": 4, "min_samples_leaf": 20, "learning_rate": 0.1, "target_annual_vol": 0, "trailing_trigger_pct": 4.586124333738947, "trailing_distance_pct": 3.0, "trailing_stop_enabled": false}	ab354536
2026-04-09T01:14:26.209804+00:00	ab354536-exp06	holding_days: 90 -> 87	1.1705	0.5072	-0.6633	discard	0.9986		{"market": "US", "start_date": "2018-01-01", "end_date": "2025-12-31", "train_window_months": 12, "test_window_months": 3, "embargo_days": 5, "holding_days": 87, "mr_holding_days": 15, "tp_pct": 10.0, "sl_pct": 12.923403579416114, "frac_diff_d": 0.4, "starting_capital": 100000.0, "max_positions": 20, "top_n_candidates": 50, "strategy": "triple_barrier", "n_estimators": 200, "max_depth": 4, "min_samples_leaf": 20, "learning_rate": 0.1, "target_annual_vol": 0, "trailing_trigger_pct": 5.0, "trailing_distance_pct": 3.0, "trailing_stop_enabled": false}	ab354536
2026-04-09T01:37:07.289698+00:00	ab354536-exp07	max_depth: 4 -> 5	1.1705	0.6111	-0.5594	discard	0.9997		{"market": "US", "start_date": "2018-01-01", "end_date": "2025-12-31", "train_window_months": 12, "test_window_months": 3, "embargo_days": 5, "holding_days": 90, "mr_holding_days": 15, "tp_pct": 10.0, "sl_pct": 12.923403579416114, "frac_diff_d": 0.4, "starting_capital": 100000.0, "max_positions": 20, "top_n_candidates": 50, "strategy": "triple_barrier", "n_estimators": 200, "max_depth": 5, "min_samples_leaf": 20, "learning_rate": 0.1, "target_annual_vol": 0, "trailing_trigger_pct": 5.0, "trailing_distance_pct": 3.0, "trailing_stop_enabled": false}	ab354536
2026-04-09T02:00:22.277706+00:00	ab354536-exp08	top_n_candidates: 50 -> 56	1.1705	0.6646	-0.5058	discard	1.0000		{"market": "US", "start_date": "2018-01-01", "end_date": "2025-12-31", "train_window_months": 12, "test_window_months": 3, "embargo_days": 5, "holding_days": 90, "mr_holding_days": 15, "tp_pct": 10.0, "sl_pct": 12.923403579416114, "frac_diff_d": 0.4, "starting_capital": 100000.0, "max_positions": 20, "top_n_candidates": 56, "strategy": "triple_barrier", "n_estimators": 200, "max_depth": 4, "min_samples_leaf": 20, "learning_rate": 0.1, "target_annual_vol": 0, "trailing_trigger_pct": 5.0, "trailing_distance_pct": 3.0, "trailing_stop_enabled": false}	ab354536
2026-04-09T02:21:28.304744+00:00	ab354536-exp09	learning_rate: 0.1 -> 0.11129935539711527	1.1705	0.5359	-0.6345	discard	0.8804		{"market": "US", "start_date": "2018-01-01", "end_date": "2025-12-31", "train_window_months": 12, "test_window_months": 3, "embargo_days": 5, "holding_days": 90, "mr_holding_days": 15, "tp_pct": 10.0, "sl_pct": 12.923403579416114, "frac_diff_d": 0.4, "starting_capital": 100000.0, "max_positions": 20, "top_n_candidates": 50, "strategy": "triple_barrier", "n_estimators": 200, "max_depth": 4, "min_samples_leaf": 20, "learning_rate": 0.11129935539711527, "target_annual_vol": 0, "trailing_trigger_pct": 5.0, "trailing_distance_pct": 3.0, "trailing_stop_enabled": false}	ab354536
2026-04-09T02:41:47.534139+00:00	ab354536-exp10	top_n_candidates: 50 -> 48	1.1705	0.6848	-0.4856	discard	1.0000		{"market": "US", "start_date": "2018-01-01", "end_date": "2025-12-31", "train_window_months": 12, "test_window_months": 3, "embargo_days": 5, "holding_days": 90, "mr_holding_days": 15, "tp_pct": 10.0, "sl_pct": 12.923403579416114, "frac_diff_d": 0.4, "starting_capital": 100000.0, "max_positions": 20, "top_n_candidates": 48, "strategy": "triple_barrier", "n_estimators": 200, "max_depth": 4, "min_samples_leaf": 20, "learning_rate": 0.1, "target_annual_vol": 0, "trailing_trigger_pct": 5.0, "trailing_distance_pct": 3.0, "trailing_stop_enabled": false}	ab354536
2026-04-09T03:02:52.875320+00:00	ab354536-exp11	trailing_distance_pct: 3.0 -> 2.413328713766121	1.1705	0.5903	-0.5802	discard	0.8117		{"market": "US", "start_date": "2018-01-01", "end_date": "2025-12-31", "train_window_months": 12, "test_window_months": 3, "embargo_days": 5, "holding_days": 90, "mr_holding_days": 15, "tp_pct": 10.0, "sl_pct": 12.923403579416114, "frac_diff_d": 0.4, "starting_capital": 100000.0, "max_positions": 20, "top_n_candidates": 50, "strategy": "triple_barrier", "n_estimators": 200, "max_depth": 4, "min_samples_leaf": 20, "learning_rate": 0.1, "target_annual_vol": 0, "trailing_trigger_pct": 5.0, "trailing_distance_pct": 2.413328713766121, "trailing_stop_enabled": false}	ab354536
2026-04-09T03:23:51.795783+00:00	ab354536-exp12	target_vol: ? -> 0.1748787028548277	1.1705	0.6514	-0.5191	discard	0.9569		{"market": "US", "start_date": "2018-01-01", "end_date": "2025-12-31", "train_window_months": 12, "test_window_months": 3, "embargo_days": 5, "holding_days": 90, "mr_holding_days": 15, "tp_pct": 10.0, "sl_pct": 12.923403579416114, "frac_diff_d": 0.4, "starting_capital": 100000.0, "max_positions": 20, "top_n_candidates": 50, "strategy": "triple_barrier", "n_estimators": 200, "max_depth": 4, "min_samples_leaf": 20, "learning_rate": 0.1, "target_annual_vol": 0, "trailing_trigger_pct": 5.0, "trailing_distance_pct": 3.0, "trailing_stop_enabled": false, "target_vol": 0.1748787028548277}	ab354536
2026-04-09T03:44:56.983231+00:00	ab354536-exp13	trailing_distance_pct: 3.0 -> 2.4982675880809495	1.1705	0.6514	-0.5191	discard	0.9335		{"market": "US", "start_date": "2018-01-01", "end_date": "2025-12-31", "train_window_months": 12, "test_window_months": 3, "embargo_days": 5, "holding_days": 90, "mr_holding_days": 15, "tp_pct": 10.0, "sl_pct": 12.923403579416114, "frac_diff_d": 0.4, "starting_capital": 100000.0, "max_positions": 20, "top_n_candidates": 50, "strategy": "triple_barrier", "n_estimators": 200, "max_depth": 4, "min_samples_leaf": 20, "learning_rate": 0.1, "target_annual_vol": 0, "trailing_trigger_pct": 5.0, "trailing_distance_pct": 2.4982675880809495, "trailing_stop_enabled": false}	ab354536
2026-04-09T04:05:51.692521+00:00	ab354536-exp14	trailing_stop_enabled: False -> True	1.1705	0.6514	-0.5191	discard	0.9042		{"market": "US", "start_date": "2018-01-01", "end_date": "2025-12-31", "train_window_months": 12, "test_window_months": 3, "embargo_days": 5, "holding_days": 90, "mr_holding_days": 15, "tp_pct": 10.0, "sl_pct": 12.923403579416114, "frac_diff_d": 0.4, "starting_capital": 100000.0, "max_positions": 20, "top_n_candidates": 50, "strategy": "triple_barrier", "n_estimators": 200, "max_depth": 4, "min_samples_leaf": 20, "learning_rate": 0.1, "target_annual_vol": 0, "trailing_trigger_pct": 5.0, "trailing_distance_pct": 3.0, "trailing_stop_enabled": true}	ab354536
2026-04-09T04:26:39.682649+00:00	ab354536-exp15	volatility_weight: ? -> 0.6143409393469474	1.1705	0.6394	-0.5311	discard	0.9094		{"market": "US", "start_date": "2018-01-01", "end_date": "2025-12-31", "train_window_months": 12, "test_window_months": 3, "embargo_days": 5, "holding_days": 90, "mr_holding_days": 15, "tp_pct": 10.0, "sl_pct": 12.923403579416114, "frac_diff_d": 0.4, "starting_capital": 100000.0, "max_positions": 20, "top_n_candidates": 50, "strategy": "triple_barrier", "n_estimators": 200, "max_depth": 4, "min_samples_leaf": 20, "learning_rate": 0.1, "target_annual_vol": 0, "trailing_trigger_pct": 5.0, "trailing_distance_pct": 3.0, "trailing_stop_enabled": false, "volatility_weight": 0.6143409393469474}	ab354536
2026-04-09T04:48:04.491168+00:00	ab354536-exp16	max_positions: 20 -> 25	1.1705	0.6307	-0.5397	discard	0.9622		{"market": "US", "start_date": "2018-01-01", "end_date": "2025-12-31", "train_window_months": 12, "test_window_months": 3, "embargo_days": 5, "holding_days": 90, "mr_holding_days": 15, "tp_pct": 10.0, "sl_pct": 12.923403579416114, "frac_diff_d": 0.4, "starting_capital": 100000.0, "max_positions": 25, "top_n_candidates": 50, "strategy": "triple_barrier", "n_estimators": 200, "max_depth": 4, "min_samples_leaf": 20, "learning_rate": 0.1, "target_annual_vol": 0, "trailing_trigger_pct": 5.0, "trailing_distance_pct": 3.0, "trailing_stop_enabled": false}	ab354536
2026-04-09T05:09:29.026223+00:00	ab354536-exp17	learning_rate: 0.1 -> 0.11705096674524387	1.1705	0.5916	-0.5788	discard	0.5545		{"market": "US", "start_date": "2018-01-01", "end_date": "2025-12-31", "train_window_months": 12, "test_window_months": 3, "embargo_days": 5, "holding_days": 90, "mr_holding_days": 15, "tp_pct": 10.0, "sl_pct": 12.923403579416114, "frac_diff_d": 0.4, "starting_capital": 100000.0, "max_positions": 20, "top_n_candidates": 50, "strategy": "triple_barrier", "n_estimators": 200, "max_depth": 4, "min_samples_leaf": 20, "learning_rate": 0.11705096674524387, "target_annual_vol": 0, "trailing_trigger_pct": 5.0, "trailing_distance_pct": 3.0, "trailing_stop_enabled": false}	ab354536
2026-04-09T05:30:49.617471+00:00	ab354536-exp18	momentum_weight: ? -> 0.6109623255159801	1.1705	0.6394	-0.5311	discard	0.8122		{"market": "US", "start_date": "2018-01-01", "end_date": "2025-12-31", "train_window_months": 12, "test_window_months": 3, "embargo_days": 5, "holding_days": 90, "mr_holding_days": 15, "tp_pct": 10.0, "sl_pct": 12.923403579416114, "frac_diff_d": 0.4, "starting_capital": 100000.0, "max_positions": 20, "top_n_candidates": 50, "strategy": "triple_barrier", "n_estimators": 200, "max_depth": 4, "min_samples_leaf": 20, "learning_rate": 0.1, "target_annual_vol": 0, "trailing_trigger_pct": 5.0, "trailing_distance_pct": 3.0, "trailing_stop_enabled": false, "momentum_weight": 0.6109623255159801}	ab354536
2026-04-09T05:56:51.899754+00:00	ab354536-exp19	top_n_candidates: 50 -> 62	1.1705	0.6979	-0.4725	discard	0.6489		{"market": "US", "start_date": "2018-01-01", "end_date": "2025-12-31", "train_window_months": 12, "test_window_months": 3, "embargo_days": 5, "holding_days": 90, "mr_holding_days": 15, "tp_pct": 10.0, "sl_pct": 12.923403579416114, "frac_diff_d": 0.4, "starting_capital": 100000.0, "max_positions": 20, "top_n_candidates": 62, "strategy": "triple_barrier", "n_estimators": 200, "max_depth": 4, "min_samples_leaf": 20, "learning_rate": 0.1, "target_annual_vol": 0, "trailing_trigger_pct": 5.0, "trailing_distance_pct": 3.0, "trailing_stop_enabled": false}	ab354536
2026-04-09T06:18:10.983316+00:00	ab354536-exp20	qm_weight: ? -> 0.42847954040061387	1.1705	0.6394	-0.5311	discard	0.7356		{"market": "US", "start_date": "2018-01-01", "end_date": "2025-12-31", "train_window_months": 12, "test_window_months": 3, "embargo_days": 5, "holding_days": 90, "mr_holding_days": 15, "tp_pct": 10.0, "sl_pct": 12.923403579416114, "frac_diff_d": 0.4, "starting_capital": 100000.0, "max_positions": 20, "top_n_candidates": 50, "strategy": "triple_barrier", "n_estimators": 200, "max_depth": 4, "min_samples_leaf": 20, "learning_rate": 0.1, "target_annual_vol": 0, "trailing_trigger_pct": 5.0, "trailing_distance_pct": 3.0, "trailing_stop_enabled": false, "qm_weight": 0.42847954040061387}	ab354536
2026-04-09T06:39:18.331273+00:00	ab354536-exp21	trailing_trigger_pct: 5.0 -> 6.336184501069649	1.1705	0.6394	-0.5311	discard	0.6957		{"market": "US", "start_date": "2018-01-01", "end_date": "2025-12-31", "train_window_months": 12, "test_window_months": 3, "embargo_days": 5, "holding_days": 90, "mr_holding_days": 15, "tp_pct": 10.0, "sl_pct": 12.923403579416114, "frac_diff_d": 0.4, "starting_capital": 100000.0, "max_positions": 20, "top_n_candidates": 50, "strategy": "triple_barrier", "n_estimators": 200, "max_depth": 4, "min_samples_leaf": 20, "learning_rate": 0.1, "target_annual_vol": 0, "trailing_trigger_pct": 6.336184501069649, "trailing_distance_pct": 3.0, "trailing_stop_enabled": false}	ab354536
2026-04-09T07:00:28.017739+00:00	ab354536-exp22	trailing_distance_pct: 3.0 -> 2.608538734220163	1.1705	0.6394	-0.5311	discard	0.6556		{"market": "US", "start_date": "2018-01-01", "end_date": "2025-12-31", "train_window_months": 12, "test_window_months": 3, "embargo_days": 5, "holding_days": 90, "mr_holding_days": 15, "tp_pct": 10.0, "sl_pct": 12.923403579416114, "frac_diff_d": 0.4, "starting_capital": 100000.0, "max_positions": 20, "top_n_candidates": 50, "strategy": "triple_barrier", "n_estimators": 200, "max_depth": 4, "min_samples_leaf": 20, "learning_rate": 0.1, "target_annual_vol": 0, "trailing_trigger_pct": 5.0, "trailing_distance_pct": 2.608538734220163, "trailing_stop_enabled": false}	ab354536
2026-04-09T07:21:52.704571+00:00	ab354536-exp23	tb_weight: ? -> 0.5913904608673812	1.1705	0.6394	-0.5311	discard	0.6157		{"market": "US", "start_date": "2018-01-01", "end_date": "2025-12-31", "train_window_months": 12, "test_window_months": 3, "embargo_days": 5, "holding_days": 90, "mr_holding_days": 15, "tp_pct": 10.0, "sl_pct": 12.923403579416114, "frac_diff_d": 0.4, "starting_capital": 100000.0, "max_positions": 20, "top_n_candidates": 50, "strategy": "triple_barrier", "n_estimators": 200, "max_depth": 4, "min_samples_leaf": 20, "learning_rate": 0.1, "target_annual_vol": 0, "trailing_trigger_pct": 5.0, "trailing_distance_pct": 3.0, "trailing_stop_enabled": false, "tb_weight": 0.5913904608673812}	ab354536
2026-04-09T07:43:06.567570+00:00	ab354536-exp24	holding_days: 90 -> 74	1.1705	0.6229	-0.5476	discard	0.9671		{"market": "US", "start_date": "2018-01-01", "end_date": "2025-12-31", "train_window_months": 12, "test_window_months": 3, "embargo_days": 5, "holding_days": 74, "mr_holding_days": 15, "tp_pct": 10.0, "sl_pct": 12.923403579416114, "frac_diff_d": 0.4, "starting_capital": 100000.0, "max_positions": 20, "top_n_candidates": 50, "strategy": "triple_barrier", "n_estimators": 200, "max_depth": 4, "min_samples_leaf": 20, "learning_rate": 0.1, "target_annual_vol": 0, "trailing_trigger_pct": 5.0, "trailing_distance_pct": 3.0, "trailing_stop_enabled": false}	ab354536
2026-04-09T08:04:17.516222+00:00	ab354536-exp25	sl_pct: 12.923403579416114 -> 10.065228471243646	1.1705	0.6381	-0.5323	discard	0.2039		{"market": "US", "start_date": "2018-01-01", "end_date": "2025-12-31", "train_window_months": 12, "test_window_months": 3, "embargo_days": 5, "holding_days": 90, "mr_holding_days": 15, "tp_pct": 10.0, "sl_pct": 10.065228471243646, "frac_diff_d": 0.4, "starting_capital": 100000.0, "max_positions": 20, "top_n_candidates": 50, "strategy": "triple_barrier", "n_estimators": 200, "max_depth": 4, "min_samples_leaf": 20, "learning_rate": 0.1, "target_annual_vol": 0, "trailing_trigger_pct": 5.0, "trailing_distance_pct": 3.0, "trailing_stop_enabled": false}	ab354536
