timestamp	run_id	param_changed	metric_before	metric_after	delta	status	dsr	top5_mda	params_json	parent_run_id
2026-04-21T11:15:27.621714+00:00	0083971f-exp51	sma_weight: ? -> 0.5619559464558179	1.1705	0.7200	-0.4505	discard	0.3365		{"market": "US", "start_date": "2018-01-01", "end_date": "2025-12-31", "train_window_months": 12, "test_window_months": 3, "embargo_days": 5, "holding_days": 90, "mr_holding_days": 15, "tp_pct": 10.0, "sl_pct": 12.923403579416114, "frac_diff_d": 0.4, "starting_capital": 100000.0, "max_positions": 20, "top_n_candidates": 50, "strategy": "triple_barrier", "n_estimators": 200, "max_depth": 4, "min_samples_leaf": 20, "learning_rate": 0.1, "target_annual_vol": 0, "trailing_trigger_pct": 5.0, "trailing_distance_pct": 3.0, "trailing_stop_enabled": false, "sma_weight": 0.5619559464558179}	0083971f
2026-04-21T11:36:17.557241+00:00	0083971f-exp52	rsi_weight: ? -> 0.6169635324061579	1.1705	0.7200	-0.4505	discard	0.3216		{"market": "US", "start_date": "2018-01-01", "end_date": "2025-12-31", "train_window_months": 12, "test_window_months": 3, "embargo_days": 5, "holding_days": 90, "mr_holding_days": 15, "tp_pct": 10.0, "sl_pct": 12.923403579416114, "frac_diff_d": 0.4, "starting_capital": 100000.0, "max_positions": 20, "top_n_candidates": 50, "strategy": "triple_barrier", "n_estimators": 200, "max_depth": 4, "min_samples_leaf": 20, "learning_rate": 0.1, "target_annual_vol": 0, "trailing_trigger_pct": 5.0, "trailing_distance_pct": 3.0, "trailing_stop_enabled": false, "rsi_weight": 0.6169635324061579}	0083971f
2026-04-21T11:57:00.003696+00:00	0083971f-exp53	max_positions: 20 -> 16	1.1705	0.7426	-0.4279	discard	0.7819		{"market": "US", "start_date": "2018-01-01", "end_date": "2025-12-31", "train_window_months": 12, "test_window_months": 3, "embargo_days": 5, "holding_days": 90, "mr_holding_days": 15, "tp_pct": 10.0, "sl_pct": 12.923403579416114, "frac_diff_d": 0.4, "starting_capital": 100000.0, "max_positions": 16, "top_n_candidates": 50, "strategy": "triple_barrier", "n_estimators": 200, "max_depth": 4, "min_samples_leaf": 20, "learning_rate": 0.1, "target_annual_vol": 0, "trailing_trigger_pct": 5.0, "trailing_distance_pct": 3.0, "trailing_stop_enabled": false}	0083971f
2026-04-21T12:17:46.668310+00:00	0083971f-exp54	trailing_trigger_pct: 5.0 -> 5.894315035564629	1.1705	0.7200	-0.4505	discard	0.2936		{"market": "US", "start_date": "2018-01-01", "end_date": "2025-12-31", "train_window_months": 12, "test_window_months": 3, "embargo_days": 5, "holding_days": 90, "mr_holding_days": 15, "tp_pct": 10.0, "sl_pct": 12.923403579416114, "frac_diff_d": 0.4, "starting_capital": 100000.0, "max_positions": 20, "top_n_candidates": 50, "strategy": "triple_barrier", "n_estimators": 200, "max_depth": 4, "min_samples_leaf": 20, "learning_rate": 0.1, "target_annual_vol": 0, "trailing_trigger_pct": 5.894315035564629, "trailing_distance_pct": 3.0, "trailing_stop_enabled": false}	0083971f
2026-04-21T12:38:21.825140+00:00	0083971f-exp55	n_estimators: 200 -> 191	1.1705	0.7381	-0.4324	discard	0.4663		{"market": "US", "start_date": "2018-01-01", "end_date": "2025-12-31", "train_window_months": 12, "test_window_months": 3, "embargo_days": 5, "holding_days": 90, "mr_holding_days": 15, "tp_pct": 10.0, "sl_pct": 12.923403579416114, "frac_diff_d": 0.4, "starting_capital": 100000.0, "max_positions": 20, "top_n_candidates": 50, "strategy": "triple_barrier", "n_estimators": 191, "max_depth": 4, "min_samples_leaf": 20, "learning_rate": 0.1, "target_annual_vol": 0, "trailing_trigger_pct": 5.0, "trailing_distance_pct": 3.0, "trailing_stop_enabled": false}	0083971f
2026-04-21T12:59:12.125407+00:00	0083971f-exp56	rsi_weight: ? -> 0.5663463239752398	1.1705	0.7200	-0.4505	discard	0.2678		{"market": "US", "start_date": "2018-01-01", "end_date": "2025-12-31", "train_window_months": 12, "test_window_months": 3, "embargo_days": 5, "holding_days": 90, "mr_holding_days": 15, "tp_pct": 10.0, "sl_pct": 12.923403579416114, "frac_diff_d": 0.4, "starting_capital": 100000.0, "max_positions": 20, "top_n_candidates": 50, "strategy": "triple_barrier", "n_estimators": 200, "max_depth": 4, "min_samples_leaf": 20, "learning_rate": 0.1, "target_annual_vol": 0, "trailing_trigger_pct": 5.0, "trailing_distance_pct": 3.0, "trailing_stop_enabled": false, "rsi_weight": 0.5663463239752398}	0083971f
2026-04-21T13:20:03.545106+00:00	0083971f-exp57	tp_pct: 10.0 -> 10.600447087825737	1.1705	0.6787	-0.4917	discard	0.3283		{"market": "US", "start_date": "2018-01-01", "end_date": "2025-12-31", "train_window_months": 12, "test_window_months": 3, "embargo_days": 5, "holding_days": 90, "mr_holding_days": 15, "tp_pct": 10.600447087825737, "sl_pct": 12.923403579416114, "frac_diff_d": 0.4, "starting_capital": 100000.0, "max_positions": 20, "top_n_candidates": 50, "strategy": "triple_barrier", "n_estimators": 200, "max_depth": 4, "min_samples_leaf": 20, "learning_rate": 0.1, "target_annual_vol": 0, "trailing_trigger_pct": 5.0, "trailing_distance_pct": 3.0, "trailing_stop_enabled": false}	0083971f
2026-04-21T13:40:55.290721+00:00	0083971f-exp58	mr_holding_days: 15 -> 12	1.1705	0.7200	-0.4505	discard	0.2442		{"market": "US", "start_date": "2018-01-01", "end_date": "2025-12-31", "train_window_months": 12, "test_window_months": 3, "embargo_days": 5, "holding_days": 90, "mr_holding_days": 12, "tp_pct": 10.0, "sl_pct": 12.923403579416114, "frac_diff_d": 0.4, "starting_capital": 100000.0, "max_positions": 20, "top_n_candidates": 50, "strategy": "triple_barrier", "n_estimators": 200, "max_depth": 4, "min_samples_leaf": 20, "learning_rate": 0.1, "target_annual_vol": 0, "trailing_trigger_pct": 5.0, "trailing_distance_pct": 3.0, "trailing_stop_enabled": false}	0083971f
2026-04-21T14:01:54.848327+00:00	0083971f-exp59	holding_days: 90 -> 103	1.1705	0.7465	-0.4240	discard	0.8723		{"market": "US", "start_date": "2018-01-01", "end_date": "2025-12-31", "train_window_months": 12, "test_window_months": 3, "embargo_days": 5, "holding_days": 103, "mr_holding_days": 15, "tp_pct": 10.0, "sl_pct": 12.923403579416114, "frac_diff_d": 0.4, "starting_capital": 100000.0, "max_positions": 20, "top_n_candidates": 50, "strategy": "triple_barrier", "n_estimators": 200, "max_depth": 4, "min_samples_leaf": 20, "learning_rate": 0.1, "target_annual_vol": 0, "trailing_trigger_pct": 5.0, "trailing_distance_pct": 3.0, "trailing_stop_enabled": false}	0083971f
2026-04-21T14:22:47.820419+00:00	0083971f-exp60	trailing_distance_pct: 3.0 -> 3.2636362248974304	1.1705	0.7200	-0.4505	discard	0.2225		{"market": "US", "start_date": "2018-01-01", "end_date": "2025-12-31", "train_window_months": 12, "test_window_months": 3, "embargo_days": 5, "holding_days": 90, "mr_holding_days": 15, "tp_pct": 10.0, "sl_pct": 12.923403579416114, "frac_diff_d": 0.4, "starting_capital": 100000.0, "max_positions": 20, "top_n_candidates": 50, "strategy": "triple_barrier", "n_estimators": 200, "max_depth": 4, "min_samples_leaf": 20, "learning_rate": 0.1, "target_annual_vol": 0, "trailing_trigger_pct": 5.0, "trailing_distance_pct": 3.2636362248974304, "trailing_stop_enabled": false}	0083971f
2026-04-21T14:43:37.755748+00:00	0083971f-exp61	fm_weight: ? -> 0.49311101714515787	1.1705	0.7200	-0.4505	discard	0.2124		{"market": "US", "start_date": "2018-01-01", "end_date": "2025-12-31", "train_window_months": 12, "test_window_months": 3, "embargo_days": 5, "holding_days": 90, "mr_holding_days": 15, "tp_pct": 10.0, "sl_pct": 12.923403579416114, "frac_diff_d": 0.4, "starting_capital": 100000.0, "max_positions": 20, "top_n_candidates": 50, "strategy": "triple_barrier", "n_estimators": 200, "max_depth": 4, "min_samples_leaf": 20, "learning_rate": 0.1, "target_annual_vol": 0, "trailing_trigger_pct": 5.0, "trailing_distance_pct": 3.0, "trailing_stop_enabled": false, "fm_weight": 0.49311101714515787}	0083971f
2026-04-21T15:04:31.029615+00:00	0083971f-exp62	tb_weight: ? -> 0.6030956971718947	1.1705	0.7200	-0.4505	discard	0.2027		{"market": "US", "start_date": "2018-01-01", "end_date": "2025-12-31", "train_window_months": 12, "test_window_months": 3, "embargo_days": 5, "holding_days": 90, "mr_holding_days": 15, "tp_pct": 10.0, "sl_pct": 12.923403579416114, "frac_diff_d": 0.4, "starting_capital": 100000.0, "max_positions": 20, "top_n_candidates": 50, "strategy": "triple_barrier", "n_estimators": 200, "max_depth": 4, "min_samples_leaf": 20, "learning_rate": 0.1, "target_annual_vol": 0, "trailing_trigger_pct": 5.0, "trailing_distance_pct": 3.0, "trailing_stop_enabled": false, "tb_weight": 0.6030956971718947}	0083971f
2026-07-24T07:42:28.563724+00:00	60617e0b	warm-start	0.0000	1.1705	+0.0000	BASELINE	0.9526		{"market": "US", "start_date": "2018-01-01", "end_date": "2025-12-31", "train_window_months": 12, "test_window_months": 3, "embargo_days": 5, "holding_days": 90, "mr_holding_days": 15, "tp_pct": 10.0, "sl_pct": 12.923403579416114, "frac_diff_d": 0.4, "starting_capital": 100000.0, "max_positions": 20, "top_n_candidates": 50, "strategy": "triple_barrier", "n_estimators": 200, "max_depth": 4, "min_samples_leaf": 20, "learning_rate": 0.1, "target_annual_vol": 0, "trailing_trigger_pct": 5.0, "trailing_distance_pct": 3.0, "trailing_stop_enabled": false}	
2026-07-24T08:02:31.569758+00:00	60617e0b-exp01	fm_weight: ? -> 0.4295976402722966	1.1705	0.6455	-0.5249	discard	0.6387		{"market": "US", "start_date": "2018-01-01", "end_date": "2025-12-31", "train_window_months": 12, "test_window_months": 3, "embargo_days": 5, "holding_days": 90, "mr_holding_days": 15, "tp_pct": 10.0, "sl_pct": 12.923403579416114, "frac_diff_d": 0.4, "starting_capital": 100000.0, "max_positions": 20, "top_n_candidates": 50, "strategy": "triple_barrier", "n_estimators": 200, "max_depth": 4, "min_samples_leaf": 20, "learning_rate": 0.1, "target_annual_vol": 0, "trailing_trigger_pct": 5.0, "trailing_distance_pct": 3.0, "trailing_stop_enabled": false, "fm_weight": 0.4295976402722966}	60617e0b
2026-07-24T08:23:01.074409+00:00	60617e0b-exp02	n_estimators: 200 -> 203	1.1705	0.6506	-0.5199	discard	0.3443		{"market": "US", "start_date": "2018-01-01", "end_date": "2025-12-31", "train_window_months": 12, "test_window_months": 3, "embargo_days": 5, "holding_days": 90, "mr_holding_days": 15, "tp_pct": 10.0, "sl_pct": 12.923403579416114, "frac_diff_d": 0.4, "starting_capital": 100000.0, "max_positions": 20, "top_n_candidates": 50, "strategy": "triple_barrier", "n_estimators": 203, "max_depth": 4, "min_samples_leaf": 20, "learning_rate": 0.1, "target_annual_vol": 0, "trailing_trigger_pct": 5.0, "trailing_distance_pct": 3.0, "trailing_stop_enabled": false}	60617e0b
2026-07-24T08:43:12.344038+00:00	60617e0b-exp03	trailing_stop_enabled: False -> True	1.1705	0.6455	-0.5249	discard	0.1679		{"market": "US", "start_date": "2018-01-01", "end_date": "2025-12-31", "train_window_months": 12, "test_window_months": 3, "embargo_days": 5, "holding_days": 90, "mr_holding_days": 15, "tp_pct": 10.0, "sl_pct": 12.923403579416114, "frac_diff_d": 0.4, "starting_capital": 100000.0, "max_positions": 20, "top_n_candidates": 50, "strategy": "triple_barrier", "n_estimators": 200, "max_depth": 4, "min_samples_leaf": 20, "learning_rate": 0.1, "target_annual_vol": 0, "trailing_trigger_pct": 5.0, "trailing_distance_pct": 3.0, "trailing_stop_enabled": true}	60617e0b
2026-07-24T09:03:30.048490+00:00	60617e0b-exp04	n_estimators: 200 -> 187	1.1705	0.5747	-0.5957	discard	0.0563		{"market": "US", "start_date": "2018-01-01", "end_date": "2025-12-31", "train_window_months": 12, "test_window_months": 3, "embargo_days": 5, "holding_days": 90, "mr_holding_days": 15, "tp_pct": 10.0, "sl_pct": 12.923403579416114, "frac_diff_d": 0.4, "starting_capital": 100000.0, "max_positions": 20, "top_n_candidates": 50, "strategy": "triple_barrier", "n_estimators": 187, "max_depth": 4, "min_samples_leaf": 20, "learning_rate": 0.1, "target_annual_vol": 0, "trailing_trigger_pct": 5.0, "trailing_distance_pct": 3.0, "trailing_stop_enabled": false}	60617e0b
2026-07-24T09:23:54.829734+00:00	60617e0b-exp05	rsi_weight: ? -> 0.5494476132589385	1.1705	0.6455	-0.5249	discard	0.0575		{"market": "US", "start_date": "2018-01-01", "end_date": "2025-12-31", "train_window_months": 12, "test_window_months": 3, "embargo_days": 5, "holding_days": 90, "mr_holding_days": 15, "tp_pct": 10.0, "sl_pct": 12.923403579416114, "frac_diff_d": 0.4, "starting_capital": 100000.0, "max_positions": 20, "top_n_candidates": 50, "strategy": "triple_barrier", "n_estimators": 200, "max_depth": 4, "min_samples_leaf": 20, "learning_rate": 0.1, "target_annual_vol": 0, "trailing_trigger_pct": 5.0, "trailing_distance_pct": 3.0, "trailing_stop_enabled": false, "rsi_weight": 0.5494476132589385}	60617e0b
2026-07-24T09:44:10.528713+00:00	60617e0b-exp06	trailing_distance_pct: 3.0 -> 2.7669479191864883	1.1705	0.6455	-0.5249	discard	0.0367		{"market": "US", "start_date": "2018-01-01", "end_date": "2025-12-31", "train_window_months": 12, "test_window_months": 3, "embargo_days": 5, "holding_days": 90, "mr_holding_days": 15, "tp_pct": 10.0, "sl_pct": 12.923403579416114, "frac_diff_d": 0.4, "starting_capital": 100000.0, "max_positions": 20, "top_n_candidates": 50, "strategy": "triple_barrier", "n_estimators": 200, "max_depth": 4, "min_samples_leaf": 20, "learning_rate": 0.1, "target_annual_vol": 0, "trailing_trigger_pct": 5.0, "trailing_distance_pct": 2.7669479191864883, "trailing_stop_enabled": false}	60617e0b
2026-07-24T10:04:20.307721+00:00	60617e0b-exp07	sl_pct: 12.923403579416114 -> 11.509924991541634	1.1705	0.5384	-0.6321	discard	0.0060		{"market": "US", "start_date": "2018-01-01", "end_date": "2025-12-31", "train_window_months": 12, "test_window_months": 3, "embargo_days": 5, "holding_days": 90, "mr_holding_days": 15, "tp_pct": 10.0, "sl_pct": 11.509924991541634, "frac_diff_d": 0.4, "starting_capital": 100000.0, "max_positions": 20, "top_n_candidates": 50, "strategy": "triple_barrier", "n_estimators": 200, "max_depth": 4, "min_samples_leaf": 20, "learning_rate": 0.1, "target_annual_vol": 0, "trailing_trigger_pct": 5.0, "trailing_distance_pct": 3.0, "trailing_stop_enabled": false}	60617e0b
2026-07-24T10:24:30.556345+00:00	60617e0b-exp08	learning_rate: 0.1 -> 0.11577169163334332	1.1705	0.5416	-0.6289	discard	0.0090		{"market": "US", "start_date": "2018-01-01", "end_date": "2025-12-31", "train_window_months": 12, "test_window_months": 3, "embargo_days": 5, "holding_days": 90, "mr_holding_days": 15, "tp_pct": 10.0, "sl_pct": 12.923403579416114, "frac_diff_d": 0.4, "starting_capital": 100000.0, "max_positions": 20, "top_n_candidates": 50, "strategy": "triple_barrier", "n_estimators": 200, "max_depth": 4, "min_samples_leaf": 20, "learning_rate": 0.11577169163334332, "target_annual_vol": 0, "trailing_trigger_pct": 5.0, "trailing_distance_pct": 3.0, "trailing_stop_enabled": false}	60617e0b
2026-07-24T10:44:41.595179+00:00	60617e0b-exp09	rsi_weight: ? -> 0.48465511336413314	1.1705	0.6455	-0.5249	discard	0.0120		{"market": "US", "start_date": "2018-01-01", "end_date": "2025-12-31", "train_window_months": 12, "test_window_months": 3, "embargo_days": 5, "holding_days": 90, "mr_holding_days": 15, "tp_pct": 10.0, "sl_pct": 12.923403579416114, "frac_diff_d": 0.4, "starting_capital": 100000.0, "max_positions": 20, "top_n_candidates": 50, "strategy": "triple_barrier", "n_estimators": 200, "max_depth": 4, "min_samples_leaf": 20, "learning_rate": 0.1, "target_annual_vol": 0, "trailing_trigger_pct": 5.0, "trailing_distance_pct": 3.0, "trailing_stop_enabled": false, "rsi_weight": 0.48465511336413314}	60617e0b
2026-07-24T11:04:50.802574+00:00	60617e0b-exp10	fm_weight: ? -> 0.44372563806606213	1.1705	0.6455	-0.5249	discard	0.0088		{"market": "US", "start_date": "2018-01-01", "end_date": "2025-12-31", "train_window_months": 12, "test_window_months": 3, "embargo_days": 5, "holding_days": 90, "mr_holding_days": 15, "tp_pct": 10.0, "sl_pct": 12.923403579416114, "frac_diff_d": 0.4, "starting_capital": 100000.0, "max_positions": 20, "top_n_candidates": 50, "strategy": "triple_barrier", "n_estimators": 200, "max_depth": 4, "min_samples_leaf": 20, "learning_rate": 0.1, "target_annual_vol": 0, "trailing_trigger_pct": 5.0, "trailing_distance_pct": 3.0, "trailing_stop_enabled": false, "fm_weight": 0.44372563806606213}	60617e0b
2026-08-04T06:36:46.311548+00:00	82.3-passA	strategy=triple_barrier		0.587648		evaluated	0.611655		"{""strategy"": ""triple_barrier"", ""pass_label"": ""full_sample_3strat"", ""K"": 8, ""pbo"": 0.7485625485625486, ""turnover_rate"": 8.754999999999999, ""net_of_cost_return_pct"": 82.74970231542848, ""sample_start"": ""2018-01-01"", ""sample_end"": ""2025-12-31"", ""macro_point_in_time_enabled"": true, ""artifact"": ""20260804T025319Z_phase_82_3_full_sample_3strat.json""}"	82.3-passA
2026-08-04T06:36:46.311694+00:00	82.3-passA	strategy=stretch_regime		0.541418		evaluated	0.535300		"{""strategy"": ""stretch_regime"", ""pass_label"": ""full_sample_3strat"", ""K"": 8, ""pbo"": 0.19603729603729603, ""turnover_rate"": 9.504999999999999, ""net_of_cost_return_pct"": 56.33020171860569, ""sample_start"": ""2018-01-01"", ""sample_end"": ""2025-12-31"", ""macro_point_in_time_enabled"": true, ""artifact"": ""20260804T025319Z_phase_82_3_full_sample_3strat.json""}"	82.3-passA
2026-08-04T06:36:46.311708+00:00	82.3-passA	strategy=reversion_sigma		0.559700		evaluated	0.606070		"{""strategy"": ""reversion_sigma"", ""pass_label"": ""full_sample_3strat"", ""K"": 8, ""pbo"": 0.3968142968142968, ""turnover_rate"": 10.030000000000001, ""net_of_cost_return_pct"": 77.86216398444213, ""sample_start"": ""2018-01-01"", ""sample_end"": ""2025-12-31"", ""macro_point_in_time_enabled"": true, ""artifact"": ""20260804T025319Z_phase_82_3_full_sample_3strat.json""}"	82.3-passA
2026-08-04T06:36:46.312135+00:00	82.3-passB	strategy=triple_barrier		1.129758		evaluated	0.756209		"{""strategy"": ""triple_barrier"", ""pass_label"": ""short_window_4strat"", ""K"": 8, ""pbo"": 0.2414918414918415, ""turnover_rate"": 1.755, ""net_of_cost_return_pct"": 7.9176118927485, ""sample_start"": ""2024-07-01"", ""sample_end"": ""2025-12-31"", ""macro_point_in_time_enabled"": true, ""artifact"": ""20260804T041628Z_phase_82_3_short_window_4strat.json""}"	82.3-passB
2026-08-04T06:36:46.312145+00:00	82.3-passB	strategy=stretch_regime		0.996612		evaluated	0.741416		"{""strategy"": ""stretch_regime"", ""pass_label"": ""short_window_4strat"", ""K"": 8, ""pbo"": 0.6888888888888889, ""turnover_rate"": 1.76, ""net_of_cost_return_pct"": 6.231770496100852, ""sample_start"": ""2024-07-01"", ""sample_end"": ""2025-12-31"", ""macro_point_in_time_enabled"": true, ""artifact"": ""20260804T041628Z_phase_82_3_short_window_4strat.json""}"	82.3-passB
2026-08-04T06:36:46.312152+00:00	82.3-passB	strategy=qarp		1.745986		evaluated	0.770290		"{""strategy"": ""qarp"", ""pass_label"": ""short_window_4strat"", ""K"": 8, ""pbo"": 0.26744366744366743, ""turnover_rate"": 1.065, ""net_of_cost_return_pct"": 7.351734764602458, ""sample_start"": ""2024-07-01"", ""sample_end"": ""2025-12-31"", ""macro_point_in_time_enabled"": true, ""artifact"": ""20260804T041628Z_phase_82_3_short_window_4strat.json""}"	82.3-passB
2026-08-04T06:36:46.312159+00:00	82.3-passB	strategy=reversion_sigma		1.376387		evaluated	0.746018		"{""strategy"": ""reversion_sigma"", ""pass_label"": ""short_window_4strat"", ""K"": 8, ""pbo"": 0.43682983682983684, ""turnover_rate"": 1.8050000000000002, ""net_of_cost_return_pct"": 8.966732636529295, ""sample_start"": ""2024-07-01"", ""sample_end"": ""2025-12-31"", ""macro_point_in_time_enabled"": true, ""artifact"": ""20260804T041628Z_phase_82_3_short_window_4strat.json""}"	82.3-passB
