timestamp	run_id	param_changed	metric_before	metric_after	delta	status	dsr	top5_mda	params_json	parent_run_id
2026-04-06T18:45:06.947235+00:00	b2f5c534-exp06	n_estimators: 200 -> 213	1.1705	0.0000	-1.1705	crash	0.0000		{"market": "US", "start_date": "2018-01-01", "end_date": "2025-12-31", "train_window_months": 12, "test_window_months": 3, "embargo_days": 5, "holding_days": 90, "mr_holding_days": 15, "tp_pct": 10.0, "sl_pct": 12.923403579416114, "frac_diff_d": 0.4, "starting_capital": 100000.0, "max_positions": 20, "top_n_candidates": 50, "strategy": "triple_barrier", "n_estimators": 213, "max_depth": 4, "min_samples_leaf": 20, "learning_rate": 0.1, "target_annual_vol": 0, "trailing_trigger_pct": 5.0, "trailing_distance_pct": 3.0, "trailing_stop_enabled": false}	b2f5c534
2026-04-06T18:45:06.947416+00:00	b2f5c534-exp07	target_vol: ? -> 0.22609402344621798	1.1705	0.0000	-1.1705	crash	0.0000		{"market": "US", "start_date": "2018-01-01", "end_date": "2025-12-31", "train_window_months": 12, "test_window_months": 3, "embargo_days": 5, "holding_days": 90, "mr_holding_days": 15, "tp_pct": 10.0, "sl_pct": 12.923403579416114, "frac_diff_d": 0.4, "starting_capital": 100000.0, "max_positions": 20, "top_n_candidates": 50, "strategy": "triple_barrier", "n_estimators": 200, "max_depth": 4, "min_samples_leaf": 20, "learning_rate": 0.1, "target_annual_vol": 0, "trailing_trigger_pct": 5.0, "trailing_distance_pct": 3.0, "trailing_stop_enabled": false, "target_vol": 0.22609402344621798}	b2f5c534
2026-04-06T18:45:06.947591+00:00	b2f5c534-exp08	trailing_distance_pct: 3.0 -> 3.468778030286854	1.1705	0.0000	-1.1705	crash	0.0000		{"market": "US", "start_date": "2018-01-01", "end_date": "2025-12-31", "train_window_months": 12, "test_window_months": 3, "embargo_days": 5, "holding_days": 90, "mr_holding_days": 15, "tp_pct": 10.0, "sl_pct": 12.923403579416114, "frac_diff_d": 0.4, "starting_capital": 100000.0, "max_positions": 20, "top_n_candidates": 50, "strategy": "triple_barrier", "n_estimators": 200, "max_depth": 4, "min_samples_leaf": 20, "learning_rate": 0.1, "target_annual_vol": 0, "trailing_trigger_pct": 5.0, "trailing_distance_pct": 3.468778030286854, "trailing_stop_enabled": false}	b2f5c534
2026-04-06T18:45:06.947762+00:00	b2f5c534-exp09	qm_weight: ? -> 0.5701506653486791	1.1705	0.0000	-1.1705	crash	0.0000		{"market": "US", "start_date": "2018-01-01", "end_date": "2025-12-31", "train_window_months": 12, "test_window_months": 3, "embargo_days": 5, "holding_days": 90, "mr_holding_days": 15, "tp_pct": 10.0, "sl_pct": 12.923403579416114, "frac_diff_d": 0.4, "starting_capital": 100000.0, "max_positions": 20, "top_n_candidates": 50, "strategy": "triple_barrier", "n_estimators": 200, "max_depth": 4, "min_samples_leaf": 20, "learning_rate": 0.1, "target_annual_vol": 0, "trailing_trigger_pct": 5.0, "trailing_distance_pct": 3.0, "trailing_stop_enabled": false, "qm_weight": 0.5701506653486791}	b2f5c534
2026-04-06T18:45:06.947937+00:00	b2f5c534-exp10	momentum_weight: ? -> 0.35562992164891405	1.1705	0.0000	-1.1705	crash	0.0000		{"market": "US", "start_date": "2018-01-01", "end_date": "2025-12-31", "train_window_months": 12, "test_window_months": 3, "embargo_days": 5, "holding_days": 90, "mr_holding_days": 15, "tp_pct": 10.0, "sl_pct": 12.923403579416114, "frac_diff_d": 0.4, "starting_capital": 100000.0, "max_positions": 20, "top_n_candidates": 50, "strategy": "triple_barrier", "n_estimators": 200, "max_depth": 4, "min_samples_leaf": 20, "learning_rate": 0.1, "target_annual_vol": 0, "trailing_trigger_pct": 5.0, "trailing_distance_pct": 3.0, "trailing_stop_enabled": false, "momentum_weight": 0.35562992164891405}	b2f5c534
2026-04-06T18:45:06.948109+00:00	b2f5c534-exp11	holding_days: 90 -> 105	1.1705	0.0000	-1.1705	crash	0.0000		{"market": "US", "start_date": "2018-01-01", "end_date": "2025-12-31", "train_window_months": 12, "test_window_months": 3, "embargo_days": 5, "holding_days": 105, "mr_holding_days": 15, "tp_pct": 10.0, "sl_pct": 12.923403579416114, "frac_diff_d": 0.4, "starting_capital": 100000.0, "max_positions": 20, "top_n_candidates": 50, "strategy": "triple_barrier", "n_estimators": 200, "max_depth": 4, "min_samples_leaf": 20, "learning_rate": 0.1, "target_annual_vol": 0, "trailing_trigger_pct": 5.0, "trailing_distance_pct": 3.0, "trailing_stop_enabled": false}	b2f5c534
2026-04-06T18:45:06.948282+00:00	b2f5c534-exp12	strategy: triple_barrier -> quality_momentum	1.1705	0.0000	-1.1705	crash	0.0000		{"market": "US", "start_date": "2018-01-01", "end_date": "2025-12-31", "train_window_months": 12, "test_window_months": 3, "embargo_days": 5, "holding_days": 90, "mr_holding_days": 15, "tp_pct": 10.0, "sl_pct": 12.923403579416114, "frac_diff_d": 0.4, "starting_capital": 100000.0, "max_positions": 20, "top_n_candidates": 50, "strategy": "quality_momentum", "n_estimators": 200, "max_depth": 4, "min_samples_leaf": 20, "learning_rate": 0.1, "target_annual_vol": 0, "trailing_trigger_pct": 5.0, "trailing_distance_pct": 3.0, "trailing_stop_enabled": false}	b2f5c534
2026-04-06T18:45:06.948454+00:00	b2f5c534-exp13	target_vol: ? -> 0.13756287315422508	1.1705	0.0000	-1.1705	crash	0.0000		{"market": "US", "start_date": "2018-01-01", "end_date": "2025-12-31", "train_window_months": 12, "test_window_months": 3, "embargo_days": 5, "holding_days": 90, "mr_holding_days": 15, "tp_pct": 10.0, "sl_pct": 12.923403579416114, "frac_diff_d": 0.4, "starting_capital": 100000.0, "max_positions": 20, "top_n_candidates": 50, "strategy": "triple_barrier", "n_estimators": 200, "max_depth": 4, "min_samples_leaf": 20, "learning_rate": 0.1, "target_annual_vol": 0, "trailing_trigger_pct": 5.0, "trailing_distance_pct": 3.0, "trailing_stop_enabled": false, "target_vol": 0.13756287315422508}	b2f5c534
2026-04-06T18:45:06.948728+00:00	b2f5c534-exp14	max_depth: 4 -> 3	1.1705	0.0000	-1.1705	crash	0.0000		{"market": "US", "start_date": "2018-01-01", "end_date": "2025-12-31", "train_window_months": 12, "test_window_months": 3, "embargo_days": 5, "holding_days": 90, "mr_holding_days": 15, "tp_pct": 10.0, "sl_pct": 12.923403579416114, "frac_diff_d": 0.4, "starting_capital": 100000.0, "max_positions": 20, "top_n_candidates": 50, "strategy": "triple_barrier", "n_estimators": 200, "max_depth": 3, "min_samples_leaf": 20, "learning_rate": 0.1, "target_annual_vol": 0, "trailing_trigger_pct": 5.0, "trailing_distance_pct": 3.0, "trailing_stop_enabled": false}	b2f5c534
2026-04-06T18:45:06.948959+00:00	b2f5c534-exp15	holding_days: 90 -> 105	1.1705	0.0000	-1.1705	crash	0.0000		{"market": "US", "start_date": "2018-01-01", "end_date": "2025-12-31", "train_window_months": 12, "test_window_months": 3, "embargo_days": 5, "holding_days": 105, "mr_holding_days": 15, "tp_pct": 10.0, "sl_pct": 12.923403579416114, "frac_diff_d": 0.4, "starting_capital": 100000.0, "max_positions": 20, "top_n_candidates": 50, "strategy": "triple_barrier", "n_estimators": 200, "max_depth": 4, "min_samples_leaf": 20, "learning_rate": 0.1, "target_annual_vol": 0, "trailing_trigger_pct": 5.0, "trailing_distance_pct": 3.0, "trailing_stop_enabled": false}	b2f5c534
2026-04-06T18:45:06.949163+00:00	b2f5c534-exp16	holding_days: 90 -> 116	1.1705	0.0000	-1.1705	crash	0.0000		{"market": "US", "start_date": "2018-01-01", "end_date": "2025-12-31", "train_window_months": 12, "test_window_months": 3, "embargo_days": 5, "holding_days": 116, "mr_holding_days": 15, "tp_pct": 10.0, "sl_pct": 12.923403579416114, "frac_diff_d": 0.4, "starting_capital": 100000.0, "max_positions": 20, "top_n_candidates": 50, "strategy": "triple_barrier", "n_estimators": 200, "max_depth": 4, "min_samples_leaf": 20, "learning_rate": 0.1, "target_annual_vol": 0, "trailing_trigger_pct": 5.0, "trailing_distance_pct": 3.0, "trailing_stop_enabled": false}	b2f5c534
2026-04-06T18:45:06.949355+00:00	b2f5c534-exp17	qm_weight: ? -> 0.6239214526027278	1.1705	0.0000	-1.1705	crash	0.0000		{"market": "US", "start_date": "2018-01-01", "end_date": "2025-12-31", "train_window_months": 12, "test_window_months": 3, "embargo_days": 5, "holding_days": 90, "mr_holding_days": 15, "tp_pct": 10.0, "sl_pct": 12.923403579416114, "frac_diff_d": 0.4, "starting_capital": 100000.0, "max_positions": 20, "top_n_candidates": 50, "strategy": "triple_barrier", "n_estimators": 200, "max_depth": 4, "min_samples_leaf": 20, "learning_rate": 0.1, "target_annual_vol": 0, "trailing_trigger_pct": 5.0, "trailing_distance_pct": 3.0, "trailing_stop_enabled": false, "qm_weight": 0.6239214526027278}	b2f5c534
2026-04-06T18:45:06.949536+00:00	b2f5c534-exp18	target_vol: ? -> 0.2149577388395348	1.1705	0.0000	-1.1705	crash	0.0000		{"market": "US", "start_date": "2018-01-01", "end_date": "2025-12-31", "train_window_months": 12, "test_window_months": 3, "embargo_days": 5, "holding_days": 90, "mr_holding_days": 15, "tp_pct": 10.0, "sl_pct": 12.923403579416114, "frac_diff_d": 0.4, "starting_capital": 100000.0, "max_positions": 20, "top_n_candidates": 50, "strategy": "triple_barrier", "n_estimators": 200, "max_depth": 4, "min_samples_leaf": 20, "learning_rate": 0.1, "target_annual_vol": 0, "trailing_trigger_pct": 5.0, "trailing_distance_pct": 3.0, "trailing_stop_enabled": false, "target_vol": 0.2149577388395348}	b2f5c534
2026-04-06T18:45:06.949718+00:00	b2f5c534-exp19	learning_rate: 0.1 -> 0.0980797279871321	1.1705	0.0000	-1.1705	crash	0.0000		{"market": "US", "start_date": "2018-01-01", "end_date": "2025-12-31", "train_window_months": 12, "test_window_months": 3, "embargo_days": 5, "holding_days": 90, "mr_holding_days": 15, "tp_pct": 10.0, "sl_pct": 12.923403579416114, "frac_diff_d": 0.4, "starting_capital": 100000.0, "max_positions": 20, "top_n_candidates": 50, "strategy": "triple_barrier", "n_estimators": 200, "max_depth": 4, "min_samples_leaf": 20, "learning_rate": 0.0980797279871321, "target_annual_vol": 0, "trailing_trigger_pct": 5.0, "trailing_distance_pct": 3.0, "trailing_stop_enabled": false}	b2f5c534
2026-04-06T18:45:06.949900+00:00	b2f5c534-exp20	n_estimators: 200 -> 248	1.1705	0.0000	-1.1705	crash	0.0000		{"market": "US", "start_date": "2018-01-01", "end_date": "2025-12-31", "train_window_months": 12, "test_window_months": 3, "embargo_days": 5, "holding_days": 90, "mr_holding_days": 15, "tp_pct": 10.0, "sl_pct": 12.923403579416114, "frac_diff_d": 0.4, "starting_capital": 100000.0, "max_positions": 20, "top_n_candidates": 50, "strategy": "triple_barrier", "n_estimators": 248, "max_depth": 4, "min_samples_leaf": 20, "learning_rate": 0.1, "target_annual_vol": 0, "trailing_trigger_pct": 5.0, "trailing_distance_pct": 3.0, "trailing_stop_enabled": false}	b2f5c534
2026-04-06T18:45:06.950122+00:00	b2f5c534-exp21	trailing_stop_enabled: False -> True	1.1705	0.0000	-1.1705	crash	0.0000		{"market": "US", "start_date": "2018-01-01", "end_date": "2025-12-31", "train_window_months": 12, "test_window_months": 3, "embargo_days": 5, "holding_days": 90, "mr_holding_days": 15, "tp_pct": 10.0, "sl_pct": 12.923403579416114, "frac_diff_d": 0.4, "starting_capital": 100000.0, "max_positions": 20, "top_n_candidates": 50, "strategy": "triple_barrier", "n_estimators": 200, "max_depth": 4, "min_samples_leaf": 20, "learning_rate": 0.1, "target_annual_vol": 0, "trailing_trigger_pct": 5.0, "trailing_distance_pct": 3.0, "trailing_stop_enabled": true}	b2f5c534
2026-04-06T18:45:06.950301+00:00	b2f5c534-exp22	fm_weight: ? -> 0.5927629311062698	1.1705	0.0000	-1.1705	crash	0.0000		{"market": "US", "start_date": "2018-01-01", "end_date": "2025-12-31", "train_window_months": 12, "test_window_months": 3, "embargo_days": 5, "holding_days": 90, "mr_holding_days": 15, "tp_pct": 10.0, "sl_pct": 12.923403579416114, "frac_diff_d": 0.4, "starting_capital": 100000.0, "max_positions": 20, "top_n_candidates": 50, "strategy": "triple_barrier", "n_estimators": 200, "max_depth": 4, "min_samples_leaf": 20, "learning_rate": 0.1, "target_annual_vol": 0, "trailing_trigger_pct": 5.0, "trailing_distance_pct": 3.0, "trailing_stop_enabled": false, "fm_weight": 0.5927629311062698}	b2f5c534
2026-04-06T18:45:06.950502+00:00	b2f5c534-exp23	rsi_weight: ? -> 0.35997208312221124	1.1705	0.0000	-1.1705	crash	0.0000		{"market": "US", "start_date": "2018-01-01", "end_date": "2025-12-31", "train_window_months": 12, "test_window_months": 3, "embargo_days": 5, "holding_days": 90, "mr_holding_days": 15, "tp_pct": 10.0, "sl_pct": 12.923403579416114, "frac_diff_d": 0.4, "starting_capital": 100000.0, "max_positions": 20, "top_n_candidates": 50, "strategy": "triple_barrier", "n_estimators": 200, "max_depth": 4, "min_samples_leaf": 20, "learning_rate": 0.1, "target_annual_vol": 0, "trailing_trigger_pct": 5.0, "trailing_distance_pct": 3.0, "trailing_stop_enabled": false, "rsi_weight": 0.35997208312221124}	b2f5c534
2026-04-06T18:45:06.950678+00:00	b2f5c534-exp24	learning_rate: 0.1 -> 0.07794955564217346	1.1705	0.0000	-1.1705	crash	0.0000		{"market": "US", "start_date": "2018-01-01", "end_date": "2025-12-31", "train_window_months": 12, "test_window_months": 3, "embargo_days": 5, "holding_days": 90, "mr_holding_days": 15, "tp_pct": 10.0, "sl_pct": 12.923403579416114, "frac_diff_d": 0.4, "starting_capital": 100000.0, "max_positions": 20, "top_n_candidates": 50, "strategy": "triple_barrier", "n_estimators": 200, "max_depth": 4, "min_samples_leaf": 20, "learning_rate": 0.07794955564217346, "target_annual_vol": 0, "trailing_trigger_pct": 5.0, "trailing_distance_pct": 3.0, "trailing_stop_enabled": false}	b2f5c534
2026-04-06T18:45:06.950860+00:00	b2f5c534-exp25	min_samples_leaf: 20 -> 21	1.1705	0.0000	-1.1705	crash	0.0000		{"market": "US", "start_date": "2018-01-01", "end_date": "2025-12-31", "train_window_months": 12, "test_window_months": 3, "embargo_days": 5, "holding_days": 90, "mr_holding_days": 15, "tp_pct": 10.0, "sl_pct": 12.923403579416114, "frac_diff_d": 0.4, "starting_capital": 100000.0, "max_positions": 20, "top_n_candidates": 50, "strategy": "triple_barrier", "n_estimators": 200, "max_depth": 4, "min_samples_leaf": 21, "learning_rate": 0.1, "target_annual_vol": 0, "trailing_trigger_pct": 5.0, "trailing_distance_pct": 3.0, "trailing_stop_enabled": false}	b2f5c534
2026-04-06T18:45:06.951037+00:00	b2f5c534-exp26	max_positions: 20 -> 21	1.1705	0.0000	-1.1705	crash	0.0000		{"market": "US", "start_date": "2018-01-01", "end_date": "2025-12-31", "train_window_months": 12, "test_window_months": 3, "embargo_days": 5, "holding_days": 90, "mr_holding_days": 15, "tp_pct": 10.0, "sl_pct": 12.923403579416114, "frac_diff_d": 0.4, "starting_capital": 100000.0, "max_positions": 21, "top_n_candidates": 50, "strategy": "triple_barrier", "n_estimators": 200, "max_depth": 4, "min_samples_leaf": 20, "learning_rate": 0.1, "target_annual_vol": 0, "trailing_trigger_pct": 5.0, "trailing_distance_pct": 3.0, "trailing_stop_enabled": false}	b2f5c534
2026-04-06T18:45:06.951221+00:00	b2f5c534-exp27	momentum_weight: ? -> 0.6483760573959674	1.1705	0.0000	-1.1705	crash	0.0000		{"market": "US", "start_date": "2018-01-01", "end_date": "2025-12-31", "train_window_months": 12, "test_window_months": 3, "embargo_days": 5, "holding_days": 90, "mr_holding_days": 15, "tp_pct": 10.0, "sl_pct": 12.923403579416114, "frac_diff_d": 0.4, "starting_capital": 100000.0, "max_positions": 20, "top_n_candidates": 50, "strategy": "triple_barrier", "n_estimators": 200, "max_depth": 4, "min_samples_leaf": 20, "learning_rate": 0.1, "target_annual_vol": 0, "trailing_trigger_pct": 5.0, "trailing_distance_pct": 3.0, "trailing_stop_enabled": false, "momentum_weight": 0.6483760573959674}	b2f5c534
2026-04-06T18:45:06.951397+00:00	b2f5c534-exp28	holding_days: 90 -> 94	1.1705	0.0000	-1.1705	crash	0.0000		{"market": "US", "start_date": "2018-01-01", "end_date": "2025-12-31", "train_window_months": 12, "test_window_months": 3, "embargo_days": 5, "holding_days": 94, "mr_holding_days": 15, "tp_pct": 10.0, "sl_pct": 12.923403579416114, "frac_diff_d": 0.4, "starting_capital": 100000.0, "max_positions": 20, "top_n_candidates": 50, "strategy": "triple_barrier", "n_estimators": 200, "max_depth": 4, "min_samples_leaf": 20, "learning_rate": 0.1, "target_annual_vol": 0, "trailing_trigger_pct": 5.0, "trailing_distance_pct": 3.0, "trailing_stop_enabled": false}	b2f5c534
2026-04-06T18:45:06.951578+00:00	b2f5c534-exp29	max_positions: 20 -> 21	1.1705	0.0000	-1.1705	crash	0.0000		{"market": "US", "start_date": "2018-01-01", "end_date": "2025-12-31", "train_window_months": 12, "test_window_months": 3, "embargo_days": 5, "holding_days": 90, "mr_holding_days": 15, "tp_pct": 10.0, "sl_pct": 12.923403579416114, "frac_diff_d": 0.4, "starting_capital": 100000.0, "max_positions": 21, "top_n_candidates": 50, "strategy": "triple_barrier", "n_estimators": 200, "max_depth": 4, "min_samples_leaf": 20, "learning_rate": 0.1, "target_annual_vol": 0, "trailing_trigger_pct": 5.0, "trailing_distance_pct": 3.0, "trailing_stop_enabled": false}	b2f5c534
2026-04-06T18:45:06.952008+00:00	b2f5c534-exp30	vol_barrier_multiplier: ? -> 1.9239704875636048	1.1705	0.0000	-1.1705	crash	0.0000		{"market": "US", "start_date": "2018-01-01", "end_date": "2025-12-31", "train_window_months": 12, "test_window_months": 3, "embargo_days": 5, "holding_days": 90, "mr_holding_days": 15, "tp_pct": 10.0, "sl_pct": 12.923403579416114, "frac_diff_d": 0.4, "starting_capital": 100000.0, "max_positions": 20, "top_n_candidates": 50, "strategy": "triple_barrier", "n_estimators": 200, "max_depth": 4, "min_samples_leaf": 20, "learning_rate": 0.1, "target_annual_vol": 0, "trailing_trigger_pct": 5.0, "trailing_distance_pct": 3.0, "trailing_stop_enabled": false, "vol_barrier_multiplier": 1.9239704875636048}	b2f5c534
2026-04-06T18:45:06.952251+00:00	b2f5c534-exp31	holding_days: 90 -> 107	1.1705	0.0000	-1.1705	crash	0.0000		{"market": "US", "start_date": "2018-01-01", "end_date": "2025-12-31", "train_window_months": 12, "test_window_months": 3, "embargo_days": 5, "holding_days": 107, "mr_holding_days": 15, "tp_pct": 10.0, "sl_pct": 12.923403579416114, "frac_diff_d": 0.4, "starting_capital": 100000.0, "max_positions": 20, "top_n_candidates": 50, "strategy": "triple_barrier", "n_estimators": 200, "max_depth": 4, "min_samples_leaf": 20, "learning_rate": 0.1, "target_annual_vol": 0, "trailing_trigger_pct": 5.0, "trailing_distance_pct": 3.0, "trailing_stop_enabled": false}	b2f5c534
2026-04-06T18:45:06.952429+00:00	b2f5c534-exp32	mr_holding_days: 15 -> 19	1.1705	0.0000	-1.1705	crash	0.0000		{"market": "US", "start_date": "2018-01-01", "end_date": "2025-12-31", "train_window_months": 12, "test_window_months": 3, "embargo_days": 5, "holding_days": 90, "mr_holding_days": 19, "tp_pct": 10.0, "sl_pct": 12.923403579416114, "frac_diff_d": 0.4, "starting_capital": 100000.0, "max_positions": 20, "top_n_candidates": 50, "strategy": "triple_barrier", "n_estimators": 200, "max_depth": 4, "min_samples_leaf": 20, "learning_rate": 0.1, "target_annual_vol": 0, "trailing_trigger_pct": 5.0, "trailing_distance_pct": 3.0, "trailing_stop_enabled": false}	b2f5c534
2026-04-06T18:45:06.952607+00:00	b2f5c534-exp33	qm_weight: ? -> 0.39730793300654055	1.1705	0.0000	-1.1705	crash	0.0000		{"market": "US", "start_date": "2018-01-01", "end_date": "2025-12-31", "train_window_months": 12, "test_window_months": 3, "embargo_days": 5, "holding_days": 90, "mr_holding_days": 15, "tp_pct": 10.0, "sl_pct": 12.923403579416114, "frac_diff_d": 0.4, "starting_capital": 100000.0, "max_positions": 20, "top_n_candidates": 50, "strategy": "triple_barrier", "n_estimators": 200, "max_depth": 4, "min_samples_leaf": 20, "learning_rate": 0.1, "target_annual_vol": 0, "trailing_trigger_pct": 5.0, "trailing_distance_pct": 3.0, "trailing_stop_enabled": false, "qm_weight": 0.39730793300654055}	b2f5c534
2026-04-06T18:45:06.952790+00:00	b2f5c534-exp34	target_annual_vol: 0 -> 0.05	1.1705	0.0000	-1.1705	crash	0.0000		{"market": "US", "start_date": "2018-01-01", "end_date": "2025-12-31", "train_window_months": 12, "test_window_months": 3, "embargo_days": 5, "holding_days": 90, "mr_holding_days": 15, "tp_pct": 10.0, "sl_pct": 12.923403579416114, "frac_diff_d": 0.4, "starting_capital": 100000.0, "max_positions": 20, "top_n_candidates": 50, "strategy": "triple_barrier", "n_estimators": 200, "max_depth": 4, "min_samples_leaf": 20, "learning_rate": 0.1, "target_annual_vol": 0.05, "trailing_trigger_pct": 5.0, "trailing_distance_pct": 3.0, "trailing_stop_enabled": false}	b2f5c534
2026-04-06T18:45:06.952988+00:00	b2f5c534-exp35	learning_rate: 0.1 -> 0.12991872768922452	1.1705	0.0000	-1.1705	crash	0.0000		{"market": "US", "start_date": "2018-01-01", "end_date": "2025-12-31", "train_window_months": 12, "test_window_months": 3, "embargo_days": 5, "holding_days": 90, "mr_holding_days": 15, "tp_pct": 10.0, "sl_pct": 12.923403579416114, "frac_diff_d": 0.4, "starting_capital": 100000.0, "max_positions": 20, "top_n_candidates": 50, "strategy": "triple_barrier", "n_estimators": 200, "max_depth": 4, "min_samples_leaf": 20, "learning_rate": 0.12991872768922452, "target_annual_vol": 0, "trailing_trigger_pct": 5.0, "trailing_distance_pct": 3.0, "trailing_stop_enabled": false}	b2f5c534
2026-04-06T18:45:06.953172+00:00	b2f5c534-exp36	sma_weight: ? -> 0.6086708161031492	1.1705	0.0000	-1.1705	crash	0.0000		{"market": "US", "start_date": "2018-01-01", "end_date": "2025-12-31", "train_window_months": 12, "test_window_months": 3, "embargo_days": 5, "holding_days": 90, "mr_holding_days": 15, "tp_pct": 10.0, "sl_pct": 12.923403579416114, "frac_diff_d": 0.4, "starting_capital": 100000.0, "max_positions": 20, "top_n_candidates": 50, "strategy": "triple_barrier", "n_estimators": 200, "max_depth": 4, "min_samples_leaf": 20, "learning_rate": 0.1, "target_annual_vol": 0, "trailing_trigger_pct": 5.0, "trailing_distance_pct": 3.0, "trailing_stop_enabled": false, "sma_weight": 0.6086708161031492}	b2f5c534
